2025-10-29 19:08:14,691 - __main__ - INFO - If you run out of GPU memory during start-up or get 'KV cache is larger than available memory' errors, retry with lower values, e.g. --gpu_memory_utilization 0.80  --max_model_len 16384
INFO:olmocr.check:pdftoppm is installed and working.
2025-10-29 19:08:14,698 - __main__ - INFO - Got --pdfs argument, going to add to the work queue
2025-10-29 19:08:14,699 - __main__ - INFO - Loading file at /home/bryanjowers/pdf-rag/test_output/validation_test/scanned_temp.pdf as PDF document
2025-10-29 19:08:14,699 - __main__ - INFO - Found 1 total pdf paths to add

Sampling PDFs to calculate optimal length:   0%|          | 0/1 [00:00<?, ?it/s]
Sampling PDFs to calculate optimal length: 100%|██████████| 1/1 [00:00<00:00, 34.92it/s]
2025-10-29 19:08:14,728 - __main__ - INFO - Calculated items_per_group: 17 based on average pages per PDF: 28.00
2025-10-29 19:08:14,766 - __main__ - INFO - Starting pipeline with PID 38812
2025-10-29 19:08:14,766 - __main__ - INFO - Downloading model with hugging face 'allenai/olmOCR-2-7B-1025-FP8'

Fetching 19 files:   0%|          | 0/19 [00:00<?, ?it/s]
Fetching 19 files: 100%|██████████| 19/19 [00:00<00:00, 23967.45it/s]
2025-10-29 19:08:14,932 - __main__ - INFO - Using internal server at http://localhost:30024/v1
INFO:olmocr.work_queue:Initialized queue with 1 work items
2025-10-29 19:08:15,082 - __main__ - WARNING - Attempt 1: Please wait for vllm server to become ready...
2025-10-29 19:08:16,120 - __main__ - WARNING - Attempt 2: Please wait for vllm server to become ready...
2025-10-29 19:08:17,158 - __main__ - WARNING - Attempt 3: Please wait for vllm server to become ready...
2025-10-29 19:08:18,202 - __main__ - WARNING - Attempt 4: Please wait for vllm server to become ready...
2025-10-29 19:08:18,445 - vllm - INFO - INFO 10-29 19:08:18 [__init__.py:216] Automatically detected platform cuda.
2025-10-29 19:08:19,238 - __main__ - WARNING - Attempt 5: Please wait for vllm server to become ready...
2025-10-29 19:08:20,282 - __main__ - WARNING - Attempt 6: Please wait for vllm server to become ready...
2025-10-29 19:08:21,318 - __main__ - WARNING - Attempt 7: Please wait for vllm server to become ready...
2025-10-29 19:08:22,359 - __main__ - WARNING - Attempt 8: Please wait for vllm server to become ready...
2025-10-29 19:08:23,404 - __main__ - WARNING - Attempt 9: Please wait for vllm server to become ready...
2025-10-29 19:08:23,966 - vllm - INFO - WARNING 10-29 19:08:23 [__init__.py:1742] argument '--disable-log-requests' is deprecated and replaced with '--enable-log-requests'. This will be removed in v0.12.0.
2025-10-29 19:08:23,969 - vllm - INFO - [1;36m(APIServer pid=38833)[0;0m INFO 10-29 19:08:23 [api_server.py:1839] vLLM API server version 0.11.0
2025-10-29 19:08:23,972 - vllm - INFO - [1;36m(APIServer pid=38833)[0;0m INFO 10-29 19:08:23 [utils.py:233] non-default args: {'model_tag': 'allenai/olmOCR-2-7B-1025-FP8', 'port': 30024, 'uvicorn_log_level': 'warning', 'model': 'allenai/olmOCR-2-7B-1025-FP8', 'max_model_len': 16384, 'served_model_name': ['olmocr'], 'gpu_memory_utilization': 0.8, 'limit_mm_per_prompt': {'video': 0}}
2025-10-29 19:08:24,441 - __main__ - WARNING - Attempt 10: Please wait for vllm server to become ready...
2025-10-29 19:08:24,627 - vllm - INFO - [1;36m(APIServer pid=38833)[0;0m INFO 10-29 19:08:24 [model.py:547] Resolved architecture: Qwen2_5_VLForConditionalGeneration
2025-10-29 19:08:24,627 - vllm - INFO - [1;36m(APIServer pid=38833)[0;0m INFO 10-29 19:08:24 [model.py:1510] Using max model len 16384
2025-10-29 19:08:25,182 - vllm - INFO - [1;36m(APIServer pid=38833)[0;0m INFO 10-29 19:08:25 [scheduler.py:205] Chunked prefill is enabled with max_num_batched_tokens=2048.
2025-10-29 19:08:25,479 - __main__ - WARNING - Attempt 11: Please wait for vllm server to become ready...
2025-10-29 19:08:26,517 - __main__ - WARNING - Attempt 12: Please wait for vllm server to become ready...
2025-10-29 19:08:27,555 - __main__ - WARNING - Attempt 13: Please wait for vllm server to become ready...
2025-10-29 19:08:28,593 - __main__ - WARNING - Attempt 14: Please wait for vllm server to become ready...
2025-10-29 19:08:29,632 - __main__ - WARNING - Attempt 15: Please wait for vllm server to become ready...
2025-10-29 19:08:30,416 - vllm - INFO - INFO 10-29 19:08:30 [__init__.py:216] Automatically detected platform cuda.
2025-10-29 19:08:30,669 - __main__ - WARNING - Attempt 16: Please wait for vllm server to become ready...
2025-10-29 19:08:31,708 - __main__ - WARNING - Attempt 17: Please wait for vllm server to become ready...
2025-10-29 19:08:32,745 - __main__ - WARNING - Attempt 18: Please wait for vllm server to become ready...
2025-10-29 19:08:33,782 - __main__ - WARNING - Attempt 19: Please wait for vllm server to become ready...
2025-10-29 19:08:34,821 - __main__ - WARNING - Attempt 20: Please wait for vllm server to become ready...
2025-10-29 19:08:35,342 - vllm - INFO - [1;36m(EngineCore_DP0 pid=38852)[0;0m INFO 10-29 19:08:35 [core.py:644] Waiting for init message from front-end.
2025-10-29 19:08:35,354 - vllm - INFO - [1;36m(EngineCore_DP0 pid=38852)[0;0m INFO 10-29 19:08:35 [core.py:77] Initializing a V1 LLM engine (v0.11.0) with config: model='allenai/olmOCR-2-7B-1025-FP8', speculative_config=None, tokenizer='allenai/olmOCR-2-7B-1025-FP8', skip_tokenizer_init=False, tokenizer_mode=auto, revision=None, tokenizer_revision=None, trust_remote_code=False, dtype=torch.bfloat16, max_seq_len=16384, download_dir=None, load_format=auto, tensor_parallel_size=1, pipeline_parallel_size=1, data_parallel_size=1, disable_custom_all_reduce=False, quantization=compressed-tensors, enforce_eager=False, kv_cache_dtype=auto, device_config=cuda, structured_outputs_config=StructuredOutputsConfig(backend='auto', disable_fallback=False, disable_any_whitespace=False, disable_additional_properties=False, reasoning_parser=''), observability_config=ObservabilityConfig(show_hidden_metrics_for_version=None, otlp_traces_endpoint=None, collect_detailed_traces=None), seed=0, served_model_name=olmocr, enable_prefix_caching=True, chunked_prefill_enabled=True, pooler_config=None, compilation_config={"level":3,"debug_dump_path":"","cache_dir":"","backend":"","custom_ops":[],"splitting_ops":["vllm.unified_attention","vllm.unified_attention_with_output","vllm.mamba_mixer2","vllm.mamba_mixer","vllm.short_conv","vllm.linear_attention","vllm.plamo2_mamba_mixer","vllm.gdn_attention","vllm.sparse_attn_indexer"],"use_inductor":true,"compile_sizes":[],"inductor_compile_config":{"enable_auto_functionalized_v2":false},"inductor_passes":{},"cudagraph_mode":[2,1],"use_cudagraph":true,"cudagraph_num_of_warmups":1,"cudagraph_capture_sizes":[512,504,496,488,480,472,464,456,448,440,432,424,416,408,400,392,384,376,368,360,352,344,336,328,320,312,304,296,288,280,272,264,256,248,240,232,224,216,208,200,192,184,176,168,160,152,144,136,128,120,112,104,96,88,80,72,64,56,48,40,32,24,16,8,4,2,1],"cudagraph_copy_inputs":false,"full_cuda_graph":false,"use_inductor_graph_partition":false,"pass_config":{},"max_capture_size":512,"local_cache_dir":null}
2025-10-29 19:08:35,872 - __main__ - WARNING - Attempt 21: Please wait for vllm server to become ready...
2025-10-29 19:08:36,910 - __main__ - WARNING - Attempt 22: Please wait for vllm server to become ready...
2025-10-29 19:08:37,119 - vllm - INFO - [Gloo] Rank 0 is connected to 0 peer ranks. Expected number of connected peer ranks is : 0
2025-10-29 19:08:37,140 - vllm - INFO - [Gloo] Rank 0 is connected to 0 peer ranks. Expected number of connected peer ranks is : 0
2025-10-29 19:08:37,148 - vllm - INFO - [Gloo] Rank 0 is connected to 0 peer ranks. Expected number of connected peer ranks is : 0
2025-10-29 19:08:37,154 - vllm - INFO - [Gloo] Rank 0 is connected to 0 peer ranks. Expected number of connected peer ranks is : 0
2025-10-29 19:08:37,159 - vllm - INFO - [Gloo] Rank 0 is connected to 0 peer ranks. Expected number of connected peer ranks is : 0
2025-10-29 19:08:37,164 - vllm - INFO - [Gloo] Rank 0 is connected to 0 peer ranks. Expected number of connected peer ranks is : 0
2025-10-29 19:08:37,165 - vllm - INFO - [1;36m(EngineCore_DP0 pid=38852)[0;0m INFO 10-29 19:08:37 [parallel_state.py:1208] rank 0 in world size 1 is assigned as DP rank 0, PP rank 0, TP rank 0, EP rank 0
2025-10-29 19:08:37,453 - vllm - INFO - [1;36m(EngineCore_DP0 pid=38852)[0;0m WARNING 10-29 19:08:37 [topk_topp_sampler.py:66] FlashInfer is not available. Falling back to the PyTorch-native implementation of top-p & top-k sampling. For the best performance, please install FlashInfer.
2025-10-29 19:08:37,949 - __main__ - WARNING - Attempt 23: Please wait for vllm server to become ready...
2025-10-29 19:08:38,987 - __main__ - WARNING - Attempt 24: Please wait for vllm server to become ready...
2025-10-29 19:08:39,098 - vllm - INFO - [1;36m(EngineCore_DP0 pid=38852)[0;0m You have video processor config saved in `preprocessor.json` file which is deprecated. Video processor configs should be saved in their own `video_preprocessor.json` file. You can rename the file or load and save the processor back which renames it automatically. Loading from `preprocessor.json` will be removed in v5.0.
2025-10-29 19:08:40,027 - __main__ - WARNING - Attempt 25: Please wait for vllm server to become ready...
2025-10-29 19:08:41,066 - __main__ - WARNING - Attempt 26: Please wait for vllm server to become ready...
2025-10-29 19:08:41,107 - vllm - INFO - [1;36m(EngineCore_DP0 pid=38852)[0;0m INFO 10-29 19:08:41 [gpu_model_runner.py:2602] Starting to load model allenai/olmOCR-2-7B-1025-FP8...
2025-10-29 19:08:41,553 - vllm - INFO - [1;36m(EngineCore_DP0 pid=38852)[0;0m INFO 10-29 19:08:41 [gpu_model_runner.py:2634] Loading model from scratch...
2025-10-29 19:08:41,691 - vllm - INFO - [1;36m(EngineCore_DP0 pid=38852)[0;0m INFO 10-29 19:08:41 [cuda.py:366] Using Flash Attention backend on V1 engine.
2025-10-29 19:08:41,964 - vllm - INFO - [1;36m(EngineCore_DP0 pid=38852)[0;0m INFO 10-29 19:08:41 [weight_utils.py:392] Using model weights format ['*.safetensors']
2025-10-29 19:08:42,106 - __main__ - WARNING - Attempt 27: Please wait for vllm server to become ready...
2025-10-29 19:08:42,114 - vllm - INFO - [1;36m(EngineCore_DP0 pid=38852)[0;0m 
Loading safetensors checkpoint shards:   0% Completed | 0/3 [00:00<?, ?it/s]
2025-10-29 19:08:43,145 - __main__ - WARNING - Attempt 28: Please wait for vllm server to become ready...
2025-10-29 19:08:44,182 - __main__ - WARNING - Attempt 29: Please wait for vllm server to become ready...
2025-10-29 19:08:45,221 - __main__ - WARNING - Attempt 30: Please wait for vllm server to become ready...
2025-10-29 19:08:46,259 - __main__ - WARNING - Attempt 31: Please wait for vllm server to become ready...
2025-10-29 19:08:47,297 - __main__ - WARNING - Attempt 32: Please wait for vllm server to become ready...
2025-10-29 19:08:48,341 - __main__ - WARNING - Attempt 33: Please wait for vllm server to become ready...
2025-10-29 19:08:49,382 - __main__ - WARNING - Attempt 34: Please wait for vllm server to become ready...
2025-10-29 19:08:50,421 - __main__ - WARNING - Attempt 35: Please wait for vllm server to become ready...
2025-10-29 19:08:51,461 - __main__ - WARNING - Attempt 36: Please wait for vllm server to become ready...
2025-10-29 19:08:52,506 - __main__ - WARNING - Attempt 37: Please wait for vllm server to become ready...
2025-10-29 19:08:53,551 - __main__ - WARNING - Attempt 38: Please wait for vllm server to become ready...
2025-10-29 19:08:54,589 - __main__ - WARNING - Attempt 39: Please wait for vllm server to become ready...
2025-10-29 19:08:54,608 - vllm - INFO - [1;36m(EngineCore_DP0 pid=38852)[0;0m 
Loading safetensors checkpoint shards:  33% Completed | 1/3 [00:12<00:24, 12.49s/it]
2025-10-29 19:08:55,631 - __main__ - WARNING - Attempt 40: Please wait for vllm server to become ready...
2025-10-29 19:08:56,670 - __main__ - WARNING - Attempt 41: Please wait for vllm server to become ready...
2025-10-29 19:08:57,715 - __main__ - WARNING - Attempt 42: Please wait for vllm server to become ready...
2025-10-29 19:08:58,759 - __main__ - WARNING - Attempt 43: Please wait for vllm server to become ready...
2025-10-29 19:08:59,797 - __main__ - WARNING - Attempt 44: Please wait for vllm server to become ready...
2025-10-29 19:09:00,841 - __main__ - WARNING - Attempt 45: Please wait for vllm server to become ready...
2025-10-29 19:09:01,882 - __main__ - WARNING - Attempt 46: Please wait for vllm server to become ready...
2025-10-29 19:09:02,927 - __main__ - WARNING - Attempt 47: Please wait for vllm server to become ready...
2025-10-29 19:09:03,968 - __main__ - WARNING - Attempt 48: Please wait for vllm server to become ready...
2025-10-29 19:09:05,006 - __main__ - WARNING - Attempt 49: Please wait for vllm server to become ready...
2025-10-29 19:09:05,186 - vllm - INFO - [1;36m(EngineCore_DP0 pid=38852)[0;0m 
Loading safetensors checkpoint shards:  67% Completed | 2/3 [00:23<00:11, 11.37s/it]
2025-10-29 19:09:06,045 - __main__ - WARNING - Attempt 50: Please wait for vllm server to become ready...
2025-10-29 19:09:07,092 - __main__ - WARNING - Attempt 51: Please wait for vllm server to become ready...
2025-10-29 19:09:08,137 - __main__ - WARNING - Attempt 52: Please wait for vllm server to become ready...
2025-10-29 19:09:09,183 - __main__ - WARNING - Attempt 53: Please wait for vllm server to become ready...
2025-10-29 19:09:10,221 - __main__ - WARNING - Attempt 54: Please wait for vllm server to become ready...
2025-10-29 19:09:10,500 - vllm - INFO - [1;36m(EngineCore_DP0 pid=38852)[0;0m 
Loading safetensors checkpoint shards: 100% Completed | 3/3 [00:28<00:00,  8.60s/it]
2025-10-29 19:09:10,500 - vllm - INFO - [1;36m(EngineCore_DP0 pid=38852)[0;0m 
Loading safetensors checkpoint shards: 100% Completed | 3/3 [00:28<00:00,  9.46s/it]
2025-10-29 19:09:10,500 - vllm - INFO - [1;36m(EngineCore_DP0 pid=38852)[0;0m
2025-10-29 19:09:10,526 - vllm - INFO - [1;36m(EngineCore_DP0 pid=38852)[0;0m INFO 10-29 19:09:10 [default_loader.py:267] Loading weights took 28.41 seconds
2025-10-29 19:09:11,115 - vllm - INFO - [1;36m(EngineCore_DP0 pid=38852)[0;0m INFO 10-29 19:09:11 [gpu_model_runner.py:2653] Model loading took 9.5222 GiB and 29.008900 seconds
2025-10-29 19:09:11,259 - __main__ - WARNING - Attempt 55: Please wait for vllm server to become ready...
2025-10-29 19:09:11,390 - vllm - INFO - [1;36m(EngineCore_DP0 pid=38852)[0;0m INFO 10-29 19:09:11 [gpu_model_runner.py:3344] Encoder cache will be initialized with a budget of 16384 tokens, and profiled with 1 image items of the maximum feature size.
2025-10-29 19:09:12,297 - __main__ - WARNING - Attempt 56: Please wait for vllm server to become ready...
2025-10-29 19:09:13,334 - __main__ - WARNING - Attempt 57: Please wait for vllm server to become ready...
2025-10-29 19:09:14,372 - __main__ - WARNING - Attempt 58: Please wait for vllm server to become ready...
2025-10-29 19:09:15,425 - __main__ - WARNING - Attempt 59: Please wait for vllm server to become ready...
2025-10-29 19:09:16,463 - __main__ - WARNING - Attempt 60: Please wait for vllm server to become ready...
2025-10-29 19:09:17,502 - __main__ - WARNING - Attempt 61: Please wait for vllm server to become ready...
2025-10-29 19:09:18,540 - __main__ - WARNING - Attempt 62: Please wait for vllm server to become ready...
2025-10-29 19:09:19,578 - __main__ - WARNING - Attempt 63: Please wait for vllm server to become ready...
2025-10-29 19:09:20,617 - __main__ - WARNING - Attempt 64: Please wait for vllm server to become ready...
2025-10-29 19:09:21,656 - __main__ - WARNING - Attempt 65: Please wait for vllm server to become ready...
2025-10-29 19:09:22,694 - __main__ - WARNING - Attempt 66: Please wait for vllm server to become ready...
2025-10-29 19:09:23,732 - __main__ - WARNING - Attempt 67: Please wait for vllm server to become ready...
2025-10-29 19:09:24,771 - __main__ - WARNING - Attempt 68: Please wait for vllm server to become ready...
2025-10-29 19:09:25,809 - __main__ - WARNING - Attempt 69: Please wait for vllm server to become ready...
2025-10-29 19:09:26,847 - __main__ - WARNING - Attempt 70: Please wait for vllm server to become ready...
2025-10-29 19:09:27,902 - __main__ - WARNING - Attempt 71: Please wait for vllm server to become ready...
2025-10-29 19:09:28,973 - __main__ - WARNING - Attempt 72: Please wait for vllm server to become ready...
2025-10-29 19:09:30,016 - __main__ - WARNING - Attempt 73: Please wait for vllm server to become ready...
2025-10-29 19:09:31,055 - __main__ - WARNING - Attempt 74: Please wait for vllm server to become ready...
2025-10-29 19:09:32,095 - __main__ - WARNING - Attempt 75: Please wait for vllm server to become ready...
2025-10-29 19:09:33,149 - __main__ - WARNING - Attempt 76: Please wait for vllm server to become ready...
2025-10-29 19:09:33,840 - vllm - INFO - [1;36m(EngineCore_DP0 pid=38852)[0;0m INFO 10-29 19:09:33 [backends.py:548] Using cache directory: /home/bryanjowers/.cache/vllm/torch_compile_cache/7bb749dc03/rank_0_0/backbone for vLLM's torch.compile
2025-10-29 19:09:33,842 - vllm - INFO - [1;36m(EngineCore_DP0 pid=38852)[0;0m INFO 10-29 19:09:33 [backends.py:559] Dynamo bytecode transform time: 12.36 s
2025-10-29 19:09:34,188 - __main__ - WARNING - Attempt 77: Please wait for vllm server to become ready...
2025-10-29 19:09:35,227 - __main__ - WARNING - Attempt 78: Please wait for vllm server to become ready...
2025-10-29 19:09:36,264 - __main__ - WARNING - Attempt 79: Please wait for vllm server to become ready...
2025-10-29 19:09:37,303 - __main__ - WARNING - Attempt 80: Please wait for vllm server to become ready...
2025-10-29 19:09:38,070 - vllm - INFO - [1;36m(EngineCore_DP0 pid=38852)[0;0m INFO 10-29 19:09:38 [backends.py:164] Directly load the compiled graph(s) for dynamic shape from the cache, took 3.594 s
2025-10-29 19:09:38,344 - __main__ - WARNING - Attempt 81: Please wait for vllm server to become ready...
2025-10-29 19:09:39,383 - __main__ - WARNING - Attempt 82: Please wait for vllm server to become ready...
2025-10-29 19:09:39,491 - vllm - INFO - [1;36m(EngineCore_DP0 pid=38852)[0;0m INFO 10-29 19:09:39 [monitor.py:34] torch.compile takes 12.36 s in total
2025-10-29 19:09:40,421 - __main__ - WARNING - Attempt 83: Please wait for vllm server to become ready...
2025-10-29 19:09:40,933 - vllm - INFO - [1;36m(EngineCore_DP0 pid=38852)[0;0m INFO 10-29 19:09:40 [gpu_worker.py:298] Available KV cache memory: 4.60 GiB
2025-10-29 19:09:41,313 - vllm - INFO - [1;36m(EngineCore_DP0 pid=38852)[0;0m INFO 10-29 19:09:41 [kv_cache_utils.py:1087] GPU KV cache size: 86,080 tokens
2025-10-29 19:09:41,313 - vllm - INFO - [1;36m(EngineCore_DP0 pid=38852)[0;0m INFO 10-29 19:09:41 [kv_cache_utils.py:1091] Maximum concurrency for 16,384 tokens per request: 5.25x
2025-10-29 19:09:41,459 - __main__ - WARNING - Attempt 84: Please wait for vllm server to become ready...
2025-10-29 19:09:42,498 - __main__ - WARNING - Attempt 85: Please wait for vllm server to become ready...
2025-10-29 19:09:43,543 - __main__ - WARNING - Attempt 86: Please wait for vllm server to become ready...
2025-10-29 19:09:44,582 - __main__ - WARNING - Attempt 87: Please wait for vllm server to become ready...
2025-10-29 19:09:45,620 - __main__ - WARNING - Attempt 88: Please wait for vllm server to become ready...
2025-10-29 19:09:46,658 - __main__ - WARNING - Attempt 89: Please wait for vllm server to become ready...
2025-10-29 19:09:47,058 - vllm - INFO - [1;36m(EngineCore_DP0 pid=38852)[0;0m 
Capturing CUDA graphs (mixed prefill-decode, PIECEWISE):   0%|          | 0/67 [00:00<?, ?it/s]
Capturing CUDA graphs (mixed prefill-decode, PIECEWISE):   3%|▎         | 2/67 [00:00<00:06, 10.34it/s]
Capturing CUDA graphs (mixed prefill-decode, PIECEWISE):   6%|▌         | 4/67 [00:00<00:06, 10.37it/s]
Capturing CUDA graphs (mixed prefill-decode, PIECEWISE):   9%|▉         | 6/67 [00:00<00:05, 10.27it/s]
Capturing CUDA graphs (mixed prefill-decode, PIECEWISE):  12%|█▁        | 8/67 [00:00<00:05, 10.38it/s]
Capturing CUDA graphs (mixed prefill-decode, PIECEWISE):  15%|█▁        | 10/67 [00:00<00:05, 10.39it/s]
Capturing CUDA graphs (mixed prefill-decode, PIECEWISE):  18%|█▊        | 12/67 [00:01<00:05, 10.44it/s]
Capturing CUDA graphs (mixed prefill-decode, PIECEWISE):  21%|██        | 14/67 [00:01<00:05, 10.51it/s]
Capturing CUDA graphs (mixed prefill-decode, PIECEWISE):  24%|██▁       | 16/67 [00:01<00:04, 10.54it/s]
Capturing CUDA graphs (mixed prefill-decode, PIECEWISE):  27%|██▋       | 18/67 [00:01<00:04, 10.74it/s]
Capturing CUDA graphs (mixed prefill-decode, PIECEWISE):  30%|██▉       | 20/67 [00:01<00:04, 10.97it/s]
Capturing CUDA graphs (mixed prefill-decode, PIECEWISE):  33%|███▎      | 22/67 [00:02<00:04, 11.15it/s]
Capturing CUDA graphs (mixed prefill-decode, PIECEWISE):  36%|███▌      | 24/67 [00:02<00:03, 11.35it/s]
Capturing CUDA graphs (mixed prefill-decode, PIECEWISE):  39%|███▉      | 26/67 [00:02<00:03, 11.44it/s]
Capturing CUDA graphs (mixed prefill-decode, PIECEWISE):  42%|████▁     | 28/67 [00:02<00:03, 11.51it/s]
Capturing CUDA graphs (mixed prefill-decode, PIECEWISE):  45%|████▁     | 30/67 [00:02<00:03, 11.59it/s]
Capturing CUDA graphs (mixed prefill-decode, PIECEWISE):  48%|████▊     | 32/67 [00:02<00:03, 11.65it/s]
Capturing CUDA graphs (mixed prefill-decode, PIECEWISE):  51%|█████     | 34/67 [00:03<00:02, 12.08it/s]
Capturing CUDA graphs (mixed prefill-decode, PIECEWISE):  54%|█████▎    | 36/67 [00:03<00:02, 12.41it/s]
Capturing CUDA graphs (mixed prefill-decode, PIECEWISE):  57%|█████▋    | 38/67 [00:03<00:02, 12.65it/s]
Capturing CUDA graphs (mixed prefill-decode, PIECEWISE):  60%|█████▉    | 40/67 [00:03<00:02, 12.76it/s]
Capturing CUDA graphs (mixed prefill-decode, PIECEWISE):  63%|██████▎   | 42/67 [00:03<00:01, 12.93it/s]
Capturing CUDA graphs (mixed prefill-decode, PIECEWISE):  66%|██████▌   | 44/67 [00:03<00:01, 13.11it/s]
Capturing CUDA graphs (mixed prefill-decode, PIECEWISE):  69%|██████▊   | 46/67 [00:03<00:01, 13.29it/s]
Capturing CUDA graphs (mixed prefill-decode, PIECEWISE):  72%|███████▁  | 48/67 [00:04<00:01, 13.34it/s]
Capturing CUDA graphs (mixed prefill-decode, PIECEWISE):  75%|███████▁  | 50/67 [00:04<00:01, 13.87it/s]
Capturing CUDA graphs (mixed prefill-decode, PIECEWISE):  78%|███████▊  | 52/67 [00:04<00:01, 14.24it/s]
Capturing CUDA graphs (mixed prefill-decode, PIECEWISE):  81%|████████  | 54/67 [00:04<00:00, 14.51it/s]
Capturing CUDA graphs (mixed prefill-decode, PIECEWISE):  84%|████████▎ | 56/67 [00:04<00:00, 14.81it/s]
Capturing CUDA graphs (mixed prefill-decode, PIECEWISE):  87%|████████▋ | 58/67 [00:04<00:00, 14.98it/s]
Capturing CUDA graphs (mixed prefill-decode, PIECEWISE):  90%|████████▉ | 60/67 [00:04<00:00, 15.24it/s]
Capturing CUDA graphs (mixed prefill-decode, PIECEWISE):  93%|█████████▎| 62/67 [00:05<00:00, 15.37it/s]
Capturing CUDA graphs (mixed prefill-decode, PIECEWISE):  96%|█████████▌| 64/67 [00:05<00:00, 15.50it/s]
Capturing CUDA graphs (mixed prefill-decode, PIECEWISE):  99%|█████████▊| 66/67 [00:05<00:00, 15.66it/s]
Capturing CUDA graphs (mixed prefill-decode, PIECEWISE): 100%|██████████| 67/67 [00:05<00:00, 12.51it/s]
2025-10-29 19:09:47,696 - __main__ - WARNING - Attempt 90: Please wait for vllm server to become ready...
2025-10-29 19:09:48,739 - __main__ - WARNING - Attempt 91: Please wait for vllm server to become ready...
2025-10-29 19:09:49,526 - vllm - INFO - [1;36m(EngineCore_DP0 pid=38852)[0;0m 
Capturing CUDA graphs (decode, FULL):   0%|          | 0/35 [00:00<?, ?it/s]
Capturing CUDA graphs (decode, FULL):   3%|▎         | 1/35 [00:00<00:05,  6.53it/s]
Capturing CUDA graphs (decode, FULL):   9%|▊         | 3/35 [00:00<00:03, 10.04it/s]
Capturing CUDA graphs (decode, FULL):  14%|█▁        | 5/35 [00:00<00:02, 11.35it/s]
Capturing CUDA graphs (decode, FULL):  20%|██        | 7/35 [00:00<00:02, 11.83it/s]
Capturing CUDA graphs (decode, FULL):  26%|██▌       | 9/35 [00:00<00:02, 12.31it/s]
Capturing CUDA graphs (decode, FULL):  31%|███▁      | 11/35 [00:00<00:01, 12.70it/s]
Capturing CUDA graphs (decode, FULL):  37%|███▋      | 13/35 [00:01<00:01, 12.93it/s]
Capturing CUDA graphs (decode, FULL):  43%|████▎     | 15/35 [00:01<00:01, 13.14it/s]
Capturing CUDA graphs (decode, FULL):  49%|████▊     | 17/35 [00:01<00:01, 13.35it/s]
Capturing CUDA graphs (decode, FULL):  54%|█████▁    | 19/35 [00:01<00:01, 13.99it/s]
Capturing CUDA graphs (decode, FULL):  60%|██████    | 21/35 [00:01<00:00, 14.53it/s]
Capturing CUDA graphs (decode, FULL):  66%|██████▌   | 23/35 [00:01<00:00, 14.95it/s]
Capturing CUDA graphs (decode, FULL):  71%|███████▁  | 25/35 [00:01<00:00, 15.38it/s]
Capturing CUDA graphs (decode, FULL):  77%|███████▋  | 27/35 [00:01<00:00, 15.69it/s]
Capturing CUDA graphs (decode, FULL):  83%|████████▎ | 29/35 [00:02<00:00, 15.93it/s]
Capturing CUDA graphs (decode, FULL):  89%|████████▊ | 31/35 [00:02<00:00, 16.14it/s]
Capturing CUDA graphs (decode, FULL):  94%|█████████▁| 33/35 [00:02<00:00, 16.33it/s]
Capturing CUDA graphs (decode, FULL): 100%|██████████| 35/35 [00:02<00:00, 16.57it/s]
Capturing CUDA graphs (decode, FULL): 100%|██████████| 35/35 [00:02<00:00, 14.18it/s]
2025-10-29 19:09:49,778 - __main__ - WARNING - Attempt 92: Please wait for vllm server to become ready...
2025-10-29 19:09:49,914 - vllm - INFO - [1;36m(EngineCore_DP0 pid=38852)[0;0m INFO 10-29 19:09:49 [gpu_model_runner.py:3480] Graph capturing finished in 9 secs, took 2.75 GiB
2025-10-29 19:09:49,965 - vllm - INFO - [1;36m(EngineCore_DP0 pid=38852)[0;0m INFO 10-29 19:09:49 [core.py:210] init engine (profile, create kv cache, warmup model) took 38.85 seconds
2025-10-29 19:09:50,816 - __main__ - WARNING - Attempt 93: Please wait for vllm server to become ready...
2025-10-29 19:09:51,017 - vllm - INFO - [1;36m(APIServer pid=38833)[0;0m INFO 10-29 19:09:51 [loggers.py:147] Engine 000: vllm cache_config_info with initialization after num_gpu_blocks is: 5380
2025-10-29 19:09:51,327 - vllm - INFO - [1;36m(APIServer pid=38833)[0;0m INFO 10-29 19:09:51 [api_server.py:1634] Supported_tasks: ['generate']
2025-10-29 19:09:51,415 - vllm - INFO - [1;36m(APIServer pid=38833)[0;0m WARNING 10-29 19:09:51 [model.py:1389] Default sampling parameters have been overridden by the model's Hugging Face generation config recommended from the model creator. If this is not intended, please relaunch vLLM instance with `--generation-config vllm`.
2025-10-29 19:09:51,415 - vllm - INFO - [1;36m(APIServer pid=38833)[0;0m INFO 10-29 19:09:51 [serving_responses.py:137] Using default chat sampling params from model: {'repetition_penalty': 1.05, 'temperature': 1e-06}
2025-10-29 19:09:51,504 - vllm - INFO - [1;36m(APIServer pid=38833)[0;0m INFO 10-29 19:09:51 [serving_chat.py:139] Using default chat sampling params from model: {'repetition_penalty': 1.05, 'temperature': 1e-06}
2025-10-29 19:09:51,593 - vllm - INFO - [1;36m(APIServer pid=38833)[0;0m INFO 10-29 19:09:51 [serving_completion.py:76] Using default completion sampling params from model: {'repetition_penalty': 1.05, 'temperature': 1e-06}
2025-10-29 19:09:51,593 - vllm - INFO - [1;36m(APIServer pid=38833)[0;0m INFO 10-29 19:09:51 [api_server.py:1912] Starting vLLM API server 0 on http://0.0.0.0:30024
2025-10-29 19:09:51,594 - vllm - INFO - [1;36m(APIServer pid=38833)[0;0m INFO 10-29 19:09:51 [launcher.py:34] Available routes are:
2025-10-29 19:09:51,594 - vllm - INFO - [1;36m(APIServer pid=38833)[0;0m INFO 10-29 19:09:51 [launcher.py:42] Route: /openapi.json, Methods: HEAD, GET
2025-10-29 19:09:51,594 - vllm - INFO - [1;36m(APIServer pid=38833)[0;0m INFO 10-29 19:09:51 [launcher.py:42] Route: /docs, Methods: HEAD, GET
2025-10-29 19:09:51,594 - vllm - INFO - [1;36m(APIServer pid=38833)[0;0m INFO 10-29 19:09:51 [launcher.py:42] Route: /docs/oauth2-redirect, Methods: HEAD, GET
2025-10-29 19:09:51,594 - vllm - INFO - [1;36m(APIServer pid=38833)[0;0m INFO 10-29 19:09:51 [launcher.py:42] Route: /redoc, Methods: HEAD, GET
2025-10-29 19:09:51,594 - vllm - INFO - [1;36m(APIServer pid=38833)[0;0m INFO 10-29 19:09:51 [launcher.py:42] Route: /health, Methods: GET
2025-10-29 19:09:51,594 - vllm - INFO - [1;36m(APIServer pid=38833)[0;0m INFO 10-29 19:09:51 [launcher.py:42] Route: /load, Methods: GET
2025-10-29 19:09:51,594 - vllm - INFO - [1;36m(APIServer pid=38833)[0;0m INFO 10-29 19:09:51 [launcher.py:42] Route: /ping, Methods: POST
2025-10-29 19:09:51,594 - vllm - INFO - [1;36m(APIServer pid=38833)[0;0m INFO 10-29 19:09:51 [launcher.py:42] Route: /ping, Methods: GET
2025-10-29 19:09:51,594 - vllm - INFO - [1;36m(APIServer pid=38833)[0;0m INFO 10-29 19:09:51 [launcher.py:42] Route: /tokenize, Methods: POST
2025-10-29 19:09:51,595 - vllm - INFO - [1;36m(APIServer pid=38833)[0;0m INFO 10-29 19:09:51 [launcher.py:42] Route: /detokenize, Methods: POST
2025-10-29 19:09:51,595 - vllm - INFO - [1;36m(APIServer pid=38833)[0;0m INFO 10-29 19:09:51 [launcher.py:42] Route: /v1/models, Methods: GET
2025-10-29 19:09:51,595 - vllm - INFO - [1;36m(APIServer pid=38833)[0;0m INFO 10-29 19:09:51 [launcher.py:42] Route: /version, Methods: GET
2025-10-29 19:09:51,595 - vllm - INFO - [1;36m(APIServer pid=38833)[0;0m INFO 10-29 19:09:51 [launcher.py:42] Route: /v1/responses, Methods: POST
2025-10-29 19:09:51,595 - vllm - INFO - [1;36m(APIServer pid=38833)[0;0m INFO 10-29 19:09:51 [launcher.py:42] Route: /v1/responses/{response_id}, Methods: GET
2025-10-29 19:09:51,595 - vllm - INFO - [1;36m(APIServer pid=38833)[0;0m INFO 10-29 19:09:51 [launcher.py:42] Route: /v1/responses/{response_id}/cancel, Methods: POST
2025-10-29 19:09:51,595 - vllm - INFO - [1;36m(APIServer pid=38833)[0;0m INFO 10-29 19:09:51 [launcher.py:42] Route: /v1/chat/completions, Methods: POST
2025-10-29 19:09:51,595 - vllm - INFO - [1;36m(APIServer pid=38833)[0;0m INFO 10-29 19:09:51 [launcher.py:42] Route: /v1/completions, Methods: POST
2025-10-29 19:09:51,595 - vllm - INFO - [1;36m(APIServer pid=38833)[0;0m INFO 10-29 19:09:51 [launcher.py:42] Route: /v1/embeddings, Methods: POST
2025-10-29 19:09:51,595 - vllm - INFO - [1;36m(APIServer pid=38833)[0;0m INFO 10-29 19:09:51 [launcher.py:42] Route: /pooling, Methods: POST
2025-10-29 19:09:51,595 - vllm - INFO - [1;36m(APIServer pid=38833)[0;0m INFO 10-29 19:09:51 [launcher.py:42] Route: /classify, Methods: POST
2025-10-29 19:09:51,596 - vllm - INFO - [1;36m(APIServer pid=38833)[0;0m INFO 10-29 19:09:51 [launcher.py:42] Route: /score, Methods: POST
2025-10-29 19:09:51,596 - vllm - INFO - [1;36m(APIServer pid=38833)[0;0m INFO 10-29 19:09:51 [launcher.py:42] Route: /v1/score, Methods: POST
2025-10-29 19:09:51,596 - vllm - INFO - [1;36m(APIServer pid=38833)[0;0m INFO 10-29 19:09:51 [launcher.py:42] Route: /v1/audio/transcriptions, Methods: POST
2025-10-29 19:09:51,596 - vllm - INFO - [1;36m(APIServer pid=38833)[0;0m INFO 10-29 19:09:51 [launcher.py:42] Route: /v1/audio/translations, Methods: POST
2025-10-29 19:09:51,596 - vllm - INFO - [1;36m(APIServer pid=38833)[0;0m INFO 10-29 19:09:51 [launcher.py:42] Route: /rerank, Methods: POST
2025-10-29 19:09:51,596 - vllm - INFO - [1;36m(APIServer pid=38833)[0;0m INFO 10-29 19:09:51 [launcher.py:42] Route: /v1/rerank, Methods: POST
2025-10-29 19:09:51,596 - vllm - INFO - [1;36m(APIServer pid=38833)[0;0m INFO 10-29 19:09:51 [launcher.py:42] Route: /v2/rerank, Methods: POST
2025-10-29 19:09:51,596 - vllm - INFO - [1;36m(APIServer pid=38833)[0;0m INFO 10-29 19:09:51 [launcher.py:42] Route: /scale_elastic_ep, Methods: POST
2025-10-29 19:09:51,596 - vllm - INFO - [1;36m(APIServer pid=38833)[0;0m INFO 10-29 19:09:51 [launcher.py:42] Route: /is_scaling_elastic_ep, Methods: POST
2025-10-29 19:09:51,596 - vllm - INFO - [1;36m(APIServer pid=38833)[0;0m INFO 10-29 19:09:51 [launcher.py:42] Route: /invocations, Methods: POST
2025-10-29 19:09:51,596 - vllm - INFO - [1;36m(APIServer pid=38833)[0;0m INFO 10-29 19:09:51 [launcher.py:42] Route: /metrics, Methods: GET
2025-10-29 19:09:51,860 - __main__ - WARNING - Attempt 94: Please wait for vllm server to become ready...
INFO:httpx:HTTP Request: GET http://localhost:30024/v1/models "HTTP/1.1 200 OK"
2025-10-29 19:09:52,905 - __main__ - INFO - vllm server is ready.
2025-10-29 19:09:52,905 - __main__ - INFO - Queue remaining: 1
2025-10-29 19:09:52,905 - __main__ - INFO - 
Metric Name                        Lifetime (tokens/sec)     Recently (tokens/sec)
----------------------------------------------------------------------------------
2025-10-29 19:09:52,906 - __main__ - INFO - 
Worker ID
---------
2025-10-29 19:09:52,907 - __main__ - INFO - Worker 0 processing work item ef525095e3e5b8f1dbde9958b3c13d135edabfeb
2025-10-29 19:09:52,907 - __main__ - INFO - Created all tasks for ef525095e3e5b8f1dbde9958b3c13d135edabfeb
2025-10-29 19:09:53,869 - vllm - INFO - [1;36m(APIServer pid=38833)[0;0m The image processor of type `Qwen2VLImageProcessor` is now loaded as a fast processor by default, even if the model checkpoint was saved with a slow processor. This is a breaking change and may produce slightly different outputs. To continue using the slow processor, instantiate this class with `use_fast=False`. Note that this behavior will be extended to all models in a future release.
2025-10-29 19:09:54,840 - vllm - INFO - [1;36m(APIServer pid=38833)[0;0m You have video processor config saved in `preprocessor.json` file which is deprecated. Video processor configs should be saved in their own `video_preprocessor.json` file. You can rename the file or load and save the processor back which renames it automatically. Loading from `preprocessor.json` will be removed in v5.0.
2025-10-29 19:09:55,822 - vllm - INFO - [1;36m(APIServer pid=38833)[0;0m INFO 10-29 19:09:55 [chat_utils.py:560] Detected the chat template content format to be 'openai'. You can set `--chat-template-content-format` to override this.
2025-10-29 19:10:02,065 - vllm - INFO - [1;36m(APIServer pid=38833)[0;0m INFO 10-29 19:10:02 [loggers.py:127] Engine 000: Avg prompt throughput: 180.2 tokens/s, Avg generation throughput: 0.1 tokens/s, Running: 1 reqs, Waiting: 0 reqs, GPU KV cache usage: 2.3%, Prefix cache hit rate: 0.0%
2025-10-29 19:10:02,065 - __main__ - INFO - New peak running requests: 1
2025-10-29 19:10:02,065 - __main__ - INFO - vllm running req: 1 queue req: 0
2025-10-29 19:10:02,907 - __main__ - INFO - Queue remaining: 0
2025-10-29 19:10:02,908 - __main__ - INFO - 
Metric Name                        Lifetime (tokens/sec)     Recently (tokens/sec)
----------------------------------------------------------------------------------
2025-10-29 19:10:02,908 - __main__ - INFO - 
Worker ID | started
----------+--------
0         | 28     
2025-10-29 19:10:12,064 - vllm - INFO - [1;36m(APIServer pid=38833)[0;0m INFO 10-29 19:10:12 [loggers.py:127] Engine 000: Avg prompt throughput: 2787.2 tokens/s, Avg generation throughput: 10.2 tokens/s, Running: 16 reqs, Waiting: 12 reqs, GPU KV cache usage: 31.0%, Prefix cache hit rate: 15.1%
2025-10-29 19:10:12,064 - __main__ - INFO - New peak running requests: 16
2025-10-29 19:10:12,064 - __main__ - INFO - vllm running req: 16 queue req: 12
2025-10-29 19:10:12,909 - __main__ - INFO - Queue remaining: 0
2025-10-29 19:10:12,909 - __main__ - INFO - 
Metric Name                        Lifetime (tokens/sec)     Recently (tokens/sec)
----------------------------------------------------------------------------------
2025-10-29 19:10:12,909 - __main__ - INFO - 
Worker ID | started
----------+--------
0         | 28     
2025-10-29 19:10:22,065 - vllm - INFO - [1;36m(APIServer pid=38833)[0;0m INFO 10-29 19:10:22 [loggers.py:127] Engine 000: Avg prompt throughput: 2588.1 tokens/s, Avg generation throughput: 97.4 tokens/s, Running: 28 reqs, Waiting: 0 reqs, GPU KV cache usage: 56.2%, Prefix cache hit rate: 15.5%
2025-10-29 19:10:22,065 - __main__ - INFO - New peak running requests: 28
2025-10-29 19:10:22,065 - __main__ - INFO - vllm running req: 28 queue req: 0
2025-10-29 19:10:22,910 - __main__ - INFO - Queue remaining: 0
2025-10-29 19:10:22,911 - __main__ - INFO - 
Metric Name                        Lifetime (tokens/sec)     Recently (tokens/sec)
----------------------------------------------------------------------------------
2025-10-29 19:10:22,911 - __main__ - INFO - 
Worker ID | started
----------+--------
0         | 28     
2025-10-29 19:10:32,065 - vllm - INFO - [1;36m(APIServer pid=38833)[0;0m INFO 10-29 19:10:32 [loggers.py:127] Engine 000: Avg prompt throughput: 0.0 tokens/s, Avg generation throughput: 505.9 tokens/s, Running: 21 reqs, Waiting: 0 reqs, GPU KV cache usage: 47.2%, Prefix cache hit rate: 15.5%
2025-10-29 19:10:32,066 - __main__ - INFO - Running requests decreased: 28 -> 21
2025-10-29 19:10:32,066 - __main__ - INFO - vllm running req: 21 queue req: 0
2025-10-29 19:10:32,279 - __main__ - INFO - Semaphore released at 21 running 0 queued, peak: 28)
2025-10-29 19:10:32,279 - __main__ - INFO - Worker 1 exiting due to empty queue
2025-10-29 19:10:32,280 - __main__ - INFO - Worker 2 exiting due to empty queue
2025-10-29 19:10:32,280 - __main__ - INFO - Worker 3 exiting due to empty queue
2025-10-29 19:10:32,280 - __main__ - INFO - Worker 4 exiting due to empty queue
2025-10-29 19:10:32,280 - __main__ - INFO - Worker 5 exiting due to empty queue
2025-10-29 19:10:32,912 - __main__ - INFO - Queue remaining: 0
2025-10-29 19:10:32,912 - __main__ - INFO - 
Metric Name                        Lifetime (tokens/sec)     Recently (tokens/sec)
----------------------------------------------------------------------------------
completed_pages                           0.05                      0.05
finished_on_attempt_0                      0.05                      0.05
server_input_tokens                     100.83                    100.83
server_output_tokens                      7.65                      7.65
2025-10-29 19:10:32,912 - __main__ - INFO - 
Worker ID | finished | started
----------+----------+--------
0         | 7        | 28     
2025-10-29 19:10:42,066 - vllm - INFO - [1;36m(APIServer pid=38833)[0;0m INFO 10-29 19:10:42 [loggers.py:127] Engine 000: Avg prompt throughput: 0.0 tokens/s, Avg generation throughput: 418.5 tokens/s, Running: 19 reqs, Waiting: 0 reqs, GPU KV cache usage: 47.4%, Prefix cache hit rate: 15.5%
2025-10-29 19:10:42,066 - __main__ - INFO - Running requests decreased: 21 -> 19
2025-10-29 19:10:42,066 - __main__ - INFO - vllm running req: 19 queue req: 0
2025-10-29 19:10:42,914 - __main__ - INFO - Queue remaining: 0
2025-10-29 19:10:42,915 - __main__ - INFO - 
Metric Name                        Lifetime (tokens/sec)     Recently (tokens/sec)
----------------------------------------------------------------------------------
completed_pages                           0.07                      0.07
finished_on_attempt_0                      0.07                      0.07
server_input_tokens                     134.32                    134.32
server_output_tokens                     14.74                     14.74
2025-10-29 19:10:42,915 - __main__ - INFO - 
Worker ID | finished | started
----------+----------+--------
0         | 10       | 28     
2025-10-29 19:10:52,067 - vllm - INFO - [1;36m(APIServer pid=38833)[0;0m INFO 10-29 19:10:52 [loggers.py:127] Engine 000: Avg prompt throughput: 0.0 tokens/s, Avg generation throughput: 331.3 tokens/s, Running: 10 reqs, Waiting: 0 reqs, GPU KV cache usage: 27.7%, Prefix cache hit rate: 15.5%
2025-10-29 19:10:52,067 - __main__ - INFO - vllm running req: 10 queue req: 0
2025-10-29 19:10:52,916 - __main__ - INFO - Queue remaining: 0
2025-10-29 19:10:52,916 - __main__ - INFO - 
Metric Name                        Lifetime (tokens/sec)     Recently (tokens/sec)
----------------------------------------------------------------------------------
completed_pages                           0.11                      0.11
finished_on_attempt_0                      0.11                      0.11
server_input_tokens                     226.49                    226.49
server_output_tokens                     43.43                     43.43
2025-10-29 19:10:52,917 - __main__ - INFO - 
Worker ID | finished | started
----------+----------+--------
0         | 18       | 28     
2025-10-29 19:11:02,068 - vllm - INFO - [1;36m(APIServer pid=38833)[0;0m INFO 10-29 19:11:02 [loggers.py:127] Engine 000: Avg prompt throughput: 0.0 tokens/s, Avg generation throughput: 123.0 tokens/s, Running: 1 reqs, Waiting: 0 reqs, GPU KV cache usage: 3.4%, Prefix cache hit rate: 15.5%
2025-10-29 19:11:02,068 - __main__ - INFO - vllm running req: 1 queue req: 0
2025-10-29 19:11:02,918 - __main__ - INFO - Queue remaining: 0
2025-10-29 19:11:02,918 - __main__ - INFO - 
Metric Name                        Lifetime (tokens/sec)     Recently (tokens/sec)
----------------------------------------------------------------------------------
completed_pages                           0.16                      0.16
finished_on_attempt_0                      0.16                      0.16
server_input_tokens                     319.54                    319.54
server_output_tokens                     82.80                     82.80
2025-10-29 19:11:02,918 - __main__ - INFO - 
Worker ID | finished | started
----------+----------+--------
0         | 27       | 28     
2025-10-29 19:11:02,940 - __main__ - INFO - Finished TaskGroup for worker on ef525095e3e5b8f1dbde9958b3c13d135edabfeb
2025-10-29 19:11:02,941 - __main__ - INFO - Got 1 docs for ef525095e3e5b8f1dbde9958b3c13d135edabfeb
2025-10-29 19:11:02,943 - __main__ - INFO - Writing 1 markdown files for ef525095e3e5b8f1dbde9958b3c13d135edabfeb
2025-10-29 19:11:02,944 - __main__ - INFO - Worker 0 exiting due to empty queue
2025-10-29 19:11:02,944 - __main__ - INFO - Got cancellation request for VLLM server
2025-10-29 19:11:02,955 - vllm - INFO - [1;36m(APIServer pid=38833)[0;0m INFO 10-29 19:11:02 [launcher.py:99] Shutting down FastAPI HTTP server.
2025-10-29 19:11:03,097 - vllm - INFO - [rank0]:[W1029 19:11:03.380600624 ProcessGroupNCCL.cpp:1538] Warning: WARNING: destroy_process_group() was not called before program exit, which can leak resources. For more info, please see https://pytorch.org/docs/stable/distributed.html#shutdown (function operator())
2025-10-29 19:11:06,478 - __main__ - INFO - ================================================================================
2025-10-29 19:11:06,478 - __main__ - INFO - FINAL METRICS SUMMARY
2025-10-29 19:11:06,478 - __main__ - INFO - ================================================================================
2025-10-29 19:11:06,478 - __main__ - INFO - Total elapsed time: 171.79 seconds
2025-10-29 19:11:06,478 - __main__ - INFO - Total Server Input tokens: 55,748
2025-10-29 19:11:06,479 - __main__ - INFO - Total Server Output tokens: 14,889
2025-10-29 19:11:06,479 - __main__ - INFO - Finished input tokens: 55,748
2025-10-29 19:11:06,479 - __main__ - INFO - Finished output tokens: 14,889
2025-10-29 19:11:06,479 - __main__ - INFO - Completed pages: 28
2025-10-29 19:11:06,479 - __main__ - INFO - Failed pages: 0
2025-10-29 19:11:06,479 - __main__ - INFO - Page Failure rate: 0.00%
2025-10-29 19:11:06,479 - __main__ - INFO - 
2025-10-29 19:11:06,479 - __main__ - INFO - Pages finished by attempt number:
2025-10-29 19:11:06,479 - __main__ - INFO -   Attempt 0: 28 pages (100.0%) - Cumulative: 28 (100.0%)
2025-10-29 19:11:06,479 - __main__ - INFO - Server Input tokens/sec rate: 324.51
2025-10-29 19:11:06,479 - __main__ - INFO - Server Output tokens/sec rate: 86.67
2025-10-29 19:11:06,479 - __main__ - INFO - Finished Input tokens/sec rate: 324.51
2025-10-29 19:11:06,479 - __main__ - INFO - Finished Output tokens/sec rate: 86.67
2025-10-29 19:11:06,480 - __main__ - INFO - ================================================================================
2025-10-29 19:11:06,480 - __main__ - INFO - Work done
2025-10-29 19:11:06,481 - __main__ - INFO - VLLM Process already terminated
