2025-10-29 20:06:09,370 - __main__ - INFO - If you run out of GPU memory during start-up or get 'KV cache is larger than available memory' errors, retry with lower values, e.g. --gpu_memory_utilization 0.80  --max_model_len 16384
INFO:olmocr.check:pdftoppm is installed and working.
2025-10-29 20:06:09,378 - __main__ - INFO - Got --pdfs argument, going to add to the work queue
2025-10-29 20:06:09,378 - __main__ - INFO - Loading file at /home/bryanjowers/pdf-rag/pdf_input/SDTO_170.0 ac 12-5-2022.pdf as PDF document
2025-10-29 20:06:09,378 - __main__ - INFO - Found 1 total pdf paths to add

Sampling PDFs to calculate optimal length:   0%|          | 0/1 [00:00<?, ?it/s]
Sampling PDFs to calculate optimal length: 100%|██████████| 1/1 [00:00<00:00, 73.64it/s]
2025-10-29 20:06:09,392 - __main__ - INFO - Calculated items_per_group: 17 based on average pages per PDF: 28.00
2025-10-29 20:06:09,527 - __main__ - INFO - Starting pipeline with PID 51602
2025-10-29 20:06:09,527 - __main__ - INFO - Downloading model with hugging face 'allenai/olmOCR-2-7B-1025-FP8'

Fetching 19 files:   0%|          | 0/19 [00:00<?, ?it/s]
Fetching 19 files: 100%|██████████| 19/19 [00:00<00:00, 17824.15it/s]
2025-10-29 20:06:09,660 - __main__ - INFO - Using internal server at http://localhost:30024/v1
INFO:olmocr.work_queue:Initialized queue with 1 work items
2025-10-29 20:06:09,815 - __main__ - WARNING - Attempt 1: Please wait for vllm server to become ready...
2025-10-29 20:06:10,863 - __main__ - WARNING - Attempt 2: Please wait for vllm server to become ready...
2025-10-29 20:06:11,899 - __main__ - WARNING - Attempt 3: Please wait for vllm server to become ready...
2025-10-29 20:06:12,935 - __main__ - WARNING - Attempt 4: Please wait for vllm server to become ready...
2025-10-29 20:06:13,270 - vllm - INFO - INFO 10-29 20:06:13 [__init__.py:216] Automatically detected platform cuda.
2025-10-29 20:06:13,973 - __main__ - WARNING - Attempt 5: Please wait for vllm server to become ready...
2025-10-29 20:06:15,011 - __main__ - WARNING - Attempt 6: Please wait for vllm server to become ready...
2025-10-29 20:06:16,048 - __main__ - WARNING - Attempt 7: Please wait for vllm server to become ready...
2025-10-29 20:06:17,086 - __main__ - WARNING - Attempt 8: Please wait for vllm server to become ready...
2025-10-29 20:06:18,124 - __main__ - WARNING - Attempt 9: Please wait for vllm server to become ready...
2025-10-29 20:06:18,857 - vllm - INFO - WARNING 10-29 20:06:18 [__init__.py:1742] argument '--disable-log-requests' is deprecated and replaced with '--enable-log-requests'. This will be removed in v0.12.0.
2025-10-29 20:06:18,860 - vllm - INFO - [1;36m(APIServer pid=51622)[0;0m INFO 10-29 20:06:18 [api_server.py:1839] vLLM API server version 0.11.0
2025-10-29 20:06:18,863 - vllm - INFO - [1;36m(APIServer pid=51622)[0;0m INFO 10-29 20:06:18 [utils.py:233] non-default args: {'model_tag': 'allenai/olmOCR-2-7B-1025-FP8', 'port': 30024, 'uvicorn_log_level': 'warning', 'model': 'allenai/olmOCR-2-7B-1025-FP8', 'max_model_len': 16384, 'served_model_name': ['olmocr'], 'gpu_memory_utilization': 0.8, 'limit_mm_per_prompt': {'video': 0}}
2025-10-29 20:06:19,161 - __main__ - WARNING - Attempt 10: Please wait for vllm server to become ready...
2025-10-29 20:06:19,344 - vllm - INFO - [1;36m(APIServer pid=51622)[0;0m INFO 10-29 20:06:19 [model.py:547] Resolved architecture: Qwen2_5_VLForConditionalGeneration
2025-10-29 20:06:19,345 - vllm - INFO - [1;36m(APIServer pid=51622)[0;0m INFO 10-29 20:06:19 [model.py:1510] Using max model len 16384
2025-10-29 20:06:19,900 - vllm - INFO - [1;36m(APIServer pid=51622)[0;0m INFO 10-29 20:06:19 [scheduler.py:205] Chunked prefill is enabled with max_num_batched_tokens=2048.
2025-10-29 20:06:20,200 - __main__ - WARNING - Attempt 11: Please wait for vllm server to become ready...
2025-10-29 20:06:21,238 - __main__ - WARNING - Attempt 12: Please wait for vllm server to become ready...
2025-10-29 20:06:22,277 - __main__ - WARNING - Attempt 13: Please wait for vllm server to become ready...
2025-10-29 20:06:23,331 - __main__ - WARNING - Attempt 14: Please wait for vllm server to become ready...
2025-10-29 20:06:24,369 - __main__ - WARNING - Attempt 15: Please wait for vllm server to become ready...
2025-10-29 20:06:25,059 - vllm - INFO - INFO 10-29 20:06:25 [__init__.py:216] Automatically detected platform cuda.
2025-10-29 20:06:25,407 - __main__ - WARNING - Attempt 16: Please wait for vllm server to become ready...
2025-10-29 20:06:26,446 - __main__ - WARNING - Attempt 17: Please wait for vllm server to become ready...
2025-10-29 20:06:27,484 - __main__ - WARNING - Attempt 18: Please wait for vllm server to become ready...
2025-10-29 20:06:28,531 - __main__ - WARNING - Attempt 19: Please wait for vllm server to become ready...
2025-10-29 20:06:29,571 - __main__ - WARNING - Attempt 20: Please wait for vllm server to become ready...
2025-10-29 20:06:29,843 - vllm - INFO - [1;36m(EngineCore_DP0 pid=51641)[0;0m INFO 10-29 20:06:29 [core.py:644] Waiting for init message from front-end.
2025-10-29 20:06:29,854 - vllm - INFO - [1;36m(EngineCore_DP0 pid=51641)[0;0m INFO 10-29 20:06:29 [core.py:77] Initializing a V1 LLM engine (v0.11.0) with config: model='allenai/olmOCR-2-7B-1025-FP8', speculative_config=None, tokenizer='allenai/olmOCR-2-7B-1025-FP8', skip_tokenizer_init=False, tokenizer_mode=auto, revision=None, tokenizer_revision=None, trust_remote_code=False, dtype=torch.bfloat16, max_seq_len=16384, download_dir=None, load_format=auto, tensor_parallel_size=1, pipeline_parallel_size=1, data_parallel_size=1, disable_custom_all_reduce=False, quantization=compressed-tensors, enforce_eager=False, kv_cache_dtype=auto, device_config=cuda, structured_outputs_config=StructuredOutputsConfig(backend='auto', disable_fallback=False, disable_any_whitespace=False, disable_additional_properties=False, reasoning_parser=''), observability_config=ObservabilityConfig(show_hidden_metrics_for_version=None, otlp_traces_endpoint=None, collect_detailed_traces=None), seed=0, served_model_name=olmocr, enable_prefix_caching=True, chunked_prefill_enabled=True, pooler_config=None, compilation_config={"level":3,"debug_dump_path":"","cache_dir":"","backend":"","custom_ops":[],"splitting_ops":["vllm.unified_attention","vllm.unified_attention_with_output","vllm.mamba_mixer2","vllm.mamba_mixer","vllm.short_conv","vllm.linear_attention","vllm.plamo2_mamba_mixer","vllm.gdn_attention","vllm.sparse_attn_indexer"],"use_inductor":true,"compile_sizes":[],"inductor_compile_config":{"enable_auto_functionalized_v2":false},"inductor_passes":{},"cudagraph_mode":[2,1],"use_cudagraph":true,"cudagraph_num_of_warmups":1,"cudagraph_capture_sizes":[512,504,496,488,480,472,464,456,448,440,432,424,416,408,400,392,384,376,368,360,352,344,336,328,320,312,304,296,288,280,272,264,256,248,240,232,224,216,208,200,192,184,176,168,160,152,144,136,128,120,112,104,96,88,80,72,64,56,48,40,32,24,16,8,4,2,1],"cudagraph_copy_inputs":false,"full_cuda_graph":false,"use_inductor_graph_partition":false,"pass_config":{},"max_capture_size":512,"local_cache_dir":null}
2025-10-29 20:06:30,618 - __main__ - WARNING - Attempt 21: Please wait for vllm server to become ready...
2025-10-29 20:06:31,479 - vllm - INFO - [Gloo] Rank 0 is connected to 0 peer ranks. Expected number of connected peer ranks is : 0
2025-10-29 20:06:31,496 - vllm - INFO - [Gloo] Rank 0 is connected to 0 peer ranks. Expected number of connected peer ranks is : 0
2025-10-29 20:06:31,505 - vllm - INFO - [Gloo] Rank 0 is connected to 0 peer ranks. Expected number of connected peer ranks is : 0
2025-10-29 20:06:31,512 - vllm - INFO - [Gloo] Rank 0 is connected to 0 peer ranks. Expected number of connected peer ranks is : 0
2025-10-29 20:06:31,517 - vllm - INFO - [Gloo] Rank 0 is connected to 0 peer ranks. Expected number of connected peer ranks is : 0
2025-10-29 20:06:31,522 - vllm - INFO - [Gloo] Rank 0 is connected to 0 peer ranks. Expected number of connected peer ranks is : 0
2025-10-29 20:06:31,522 - vllm - INFO - [1;36m(EngineCore_DP0 pid=51641)[0;0m INFO 10-29 20:06:31 [parallel_state.py:1208] rank 0 in world size 1 is assigned as DP rank 0, PP rank 0, TP rank 0, EP rank 0
2025-10-29 20:06:31,658 - __main__ - WARNING - Attempt 22: Please wait for vllm server to become ready...
2025-10-29 20:06:31,783 - vllm - INFO - [1;36m(EngineCore_DP0 pid=51641)[0;0m WARNING 10-29 20:06:31 [topk_topp_sampler.py:66] FlashInfer is not available. Falling back to the PyTorch-native implementation of top-p & top-k sampling. For the best performance, please install FlashInfer.
2025-10-29 20:06:32,699 - __main__ - WARNING - Attempt 23: Please wait for vllm server to become ready...
2025-10-29 20:06:33,280 - vllm - INFO - [1;36m(EngineCore_DP0 pid=51641)[0;0m You have video processor config saved in `preprocessor.json` file which is deprecated. Video processor configs should be saved in their own `video_preprocessor.json` file. You can rename the file or load and save the processor back which renames it automatically. Loading from `preprocessor.json` will be removed in v5.0.
2025-10-29 20:06:33,739 - __main__ - WARNING - Attempt 24: Please wait for vllm server to become ready...
2025-10-29 20:06:34,778 - __main__ - WARNING - Attempt 25: Please wait for vllm server to become ready...
2025-10-29 20:06:35,113 - vllm - INFO - [1;36m(EngineCore_DP0 pid=51641)[0;0m INFO 10-29 20:06:35 [gpu_model_runner.py:2602] Starting to load model allenai/olmOCR-2-7B-1025-FP8...
2025-10-29 20:06:35,519 - vllm - INFO - [1;36m(EngineCore_DP0 pid=51641)[0;0m INFO 10-29 20:06:35 [gpu_model_runner.py:2634] Loading model from scratch...
2025-10-29 20:06:35,650 - vllm - INFO - [1;36m(EngineCore_DP0 pid=51641)[0;0m INFO 10-29 20:06:35 [cuda.py:366] Using Flash Attention backend on V1 engine.
2025-10-29 20:06:35,844 - __main__ - WARNING - Attempt 26: Please wait for vllm server to become ready...
2025-10-29 20:06:35,917 - vllm - INFO - [1;36m(EngineCore_DP0 pid=51641)[0;0m INFO 10-29 20:06:35 [weight_utils.py:392] Using model weights format ['*.safetensors']
2025-10-29 20:06:36,042 - vllm - INFO - [1;36m(EngineCore_DP0 pid=51641)[0;0m 
Loading safetensors checkpoint shards:   0% Completed | 0/3 [00:00<?, ?it/s]
2025-10-29 20:06:36,883 - __main__ - WARNING - Attempt 27: Please wait for vllm server to become ready...
2025-10-29 20:06:37,920 - __main__ - WARNING - Attempt 28: Please wait for vllm server to become ready...
2025-10-29 20:06:38,964 - __main__ - WARNING - Attempt 29: Please wait for vllm server to become ready...
2025-10-29 20:06:40,003 - __main__ - WARNING - Attempt 30: Please wait for vllm server to become ready...
2025-10-29 20:06:41,045 - __main__ - WARNING - Attempt 31: Please wait for vllm server to become ready...
2025-10-29 20:06:42,088 - __main__ - WARNING - Attempt 32: Please wait for vllm server to become ready...
2025-10-29 20:06:43,127 - __main__ - WARNING - Attempt 33: Please wait for vllm server to become ready...
2025-10-29 20:06:43,274 - vllm - INFO - [1;36m(EngineCore_DP0 pid=51641)[0;0m 
Loading safetensors checkpoint shards:  33% Completed | 1/3 [00:07<00:14,  7.23s/it]
2025-10-29 20:06:44,168 - __main__ - WARNING - Attempt 34: Please wait for vllm server to become ready...
2025-10-29 20:06:44,743 - vllm - INFO - [1;36m(EngineCore_DP0 pid=51641)[0;0m 
Loading safetensors checkpoint shards:  67% Completed | 2/3 [00:08<00:03,  3.84s/it]
2025-10-29 20:06:45,206 - __main__ - WARNING - Attempt 35: Please wait for vllm server to become ready...
2025-10-29 20:06:45,240 - vllm - INFO - [1;36m(EngineCore_DP0 pid=51641)[0;0m 
Loading safetensors checkpoint shards: 100% Completed | 3/3 [00:09<00:00,  2.31s/it]
2025-10-29 20:06:45,240 - vllm - INFO - [1;36m(EngineCore_DP0 pid=51641)[0;0m 
Loading safetensors checkpoint shards: 100% Completed | 3/3 [00:09<00:00,  3.07s/it]
2025-10-29 20:06:45,240 - vllm - INFO - [1;36m(EngineCore_DP0 pid=51641)[0;0m
2025-10-29 20:06:45,266 - vllm - INFO - [1;36m(EngineCore_DP0 pid=51641)[0;0m INFO 10-29 20:06:45 [default_loader.py:267] Loading weights took 9.22 seconds
2025-10-29 20:06:45,810 - vllm - INFO - [1;36m(EngineCore_DP0 pid=51641)[0;0m INFO 10-29 20:06:45 [gpu_model_runner.py:2653] Model loading took 9.5222 GiB and 9.772973 seconds
2025-10-29 20:06:46,096 - vllm - INFO - [1;36m(EngineCore_DP0 pid=51641)[0;0m INFO 10-29 20:06:46 [gpu_model_runner.py:3344] Encoder cache will be initialized with a budget of 16384 tokens, and profiled with 1 image items of the maximum feature size.
2025-10-29 20:06:46,273 - __main__ - WARNING - Attempt 36: Please wait for vllm server to become ready...
2025-10-29 20:06:47,338 - __main__ - WARNING - Attempt 37: Please wait for vllm server to become ready...
2025-10-29 20:06:48,379 - __main__ - WARNING - Attempt 38: Please wait for vllm server to become ready...
2025-10-29 20:06:49,418 - __main__ - WARNING - Attempt 39: Please wait for vllm server to become ready...
2025-10-29 20:06:50,458 - __main__ - WARNING - Attempt 40: Please wait for vllm server to become ready...
2025-10-29 20:06:51,497 - __main__ - WARNING - Attempt 41: Please wait for vllm server to become ready...
2025-10-29 20:06:52,536 - __main__ - WARNING - Attempt 42: Please wait for vllm server to become ready...
2025-10-29 20:06:53,575 - __main__ - WARNING - Attempt 43: Please wait for vllm server to become ready...
2025-10-29 20:06:54,614 - __main__ - WARNING - Attempt 44: Please wait for vllm server to become ready...
2025-10-29 20:06:55,655 - __main__ - WARNING - Attempt 45: Please wait for vllm server to become ready...
2025-10-29 20:06:56,693 - __main__ - WARNING - Attempt 46: Please wait for vllm server to become ready...
2025-10-29 20:06:57,733 - __main__ - WARNING - Attempt 47: Please wait for vllm server to become ready...
2025-10-29 20:06:58,774 - __main__ - WARNING - Attempt 48: Please wait for vllm server to become ready...
2025-10-29 20:06:59,813 - __main__ - WARNING - Attempt 49: Please wait for vllm server to become ready...
2025-10-29 20:07:00,853 - __main__ - WARNING - Attempt 50: Please wait for vllm server to become ready...
2025-10-29 20:07:01,892 - __main__ - WARNING - Attempt 51: Please wait for vllm server to become ready...
2025-10-29 20:07:02,932 - __main__ - WARNING - Attempt 52: Please wait for vllm server to become ready...
2025-10-29 20:07:03,971 - __main__ - WARNING - Attempt 53: Please wait for vllm server to become ready...
2025-10-29 20:07:05,010 - __main__ - WARNING - Attempt 54: Please wait for vllm server to become ready...
2025-10-29 20:07:06,049 - __main__ - WARNING - Attempt 55: Please wait for vllm server to become ready...
2025-10-29 20:07:07,086 - __main__ - WARNING - Attempt 56: Please wait for vllm server to become ready...
2025-10-29 20:07:08,124 - __main__ - WARNING - Attempt 57: Please wait for vllm server to become ready...
2025-10-29 20:07:08,595 - vllm - INFO - [1;36m(EngineCore_DP0 pid=51641)[0;0m INFO 10-29 20:07:08 [backends.py:548] Using cache directory: /home/bryanjowers/.cache/vllm/torch_compile_cache/7bb749dc03/rank_0_0/backbone for vLLM's torch.compile
2025-10-29 20:07:08,597 - vllm - INFO - [1;36m(EngineCore_DP0 pid=51641)[0;0m INFO 10-29 20:07:08 [backends.py:559] Dynamo bytecode transform time: 12.35 s
2025-10-29 20:07:09,165 - __main__ - WARNING - Attempt 58: Please wait for vllm server to become ready...
2025-10-29 20:07:10,204 - __main__ - WARNING - Attempt 59: Please wait for vllm server to become ready...
2025-10-29 20:07:11,245 - __main__ - WARNING - Attempt 60: Please wait for vllm server to become ready...
2025-10-29 20:07:12,284 - __main__ - WARNING - Attempt 61: Please wait for vllm server to become ready...
2025-10-29 20:07:12,881 - vllm - INFO - [1;36m(EngineCore_DP0 pid=51641)[0;0m INFO 10-29 20:07:12 [backends.py:164] Directly load the compiled graph(s) for dynamic shape from the cache, took 3.641 s
2025-10-29 20:07:13,323 - __main__ - WARNING - Attempt 62: Please wait for vllm server to become ready...
2025-10-29 20:07:14,288 - vllm - INFO - [1;36m(EngineCore_DP0 pid=51641)[0;0m INFO 10-29 20:07:14 [monitor.py:34] torch.compile takes 12.35 s in total
2025-10-29 20:07:14,362 - __main__ - WARNING - Attempt 63: Please wait for vllm server to become ready...
2025-10-29 20:07:15,406 - __main__ - WARNING - Attempt 64: Please wait for vllm server to become ready...
2025-10-29 20:07:15,729 - vllm - INFO - [1;36m(EngineCore_DP0 pid=51641)[0;0m INFO 10-29 20:07:15 [gpu_worker.py:298] Available KV cache memory: 4.60 GiB
2025-10-29 20:07:16,095 - vllm - INFO - [1;36m(EngineCore_DP0 pid=51641)[0;0m INFO 10-29 20:07:16 [kv_cache_utils.py:1087] GPU KV cache size: 86,080 tokens
2025-10-29 20:07:16,095 - vllm - INFO - [1;36m(EngineCore_DP0 pid=51641)[0;0m INFO 10-29 20:07:16 [kv_cache_utils.py:1091] Maximum concurrency for 16,384 tokens per request: 5.25x
2025-10-29 20:07:16,445 - __main__ - WARNING - Attempt 65: Please wait for vllm server to become ready...
2025-10-29 20:07:17,482 - __main__ - WARNING - Attempt 66: Please wait for vllm server to become ready...
2025-10-29 20:07:18,521 - __main__ - WARNING - Attempt 67: Please wait for vllm server to become ready...
2025-10-29 20:07:19,560 - __main__ - WARNING - Attempt 68: Please wait for vllm server to become ready...
2025-10-29 20:07:20,608 - __main__ - WARNING - Attempt 69: Please wait for vllm server to become ready...
2025-10-29 20:07:21,646 - __main__ - WARNING - Attempt 70: Please wait for vllm server to become ready...
2025-10-29 20:07:21,847 - vllm - INFO - [1;36m(EngineCore_DP0 pid=51641)[0;0m 
Capturing CUDA graphs (mixed prefill-decode, PIECEWISE):   0%|          | 0/67 [00:00<?, ?it/s]
Capturing CUDA graphs (mixed prefill-decode, PIECEWISE):   3%|▎         | 2/67 [00:00<00:06, 10.37it/s]
Capturing CUDA graphs (mixed prefill-decode, PIECEWISE):   6%|▌         | 4/67 [00:00<00:06, 10.38it/s]
Capturing CUDA graphs (mixed prefill-decode, PIECEWISE):   9%|▉         | 6/67 [00:00<00:05, 10.47it/s]
Capturing CUDA graphs (mixed prefill-decode, PIECEWISE):  12%|█▁        | 8/67 [00:00<00:05, 10.52it/s]
Capturing CUDA graphs (mixed prefill-decode, PIECEWISE):  15%|█▁        | 10/67 [00:00<00:05, 10.51it/s]
Capturing CUDA graphs (mixed prefill-decode, PIECEWISE):  18%|█▊        | 12/67 [00:01<00:05, 10.55it/s]
Capturing CUDA graphs (mixed prefill-decode, PIECEWISE):  21%|██        | 14/67 [00:01<00:05, 10.59it/s]
Capturing CUDA graphs (mixed prefill-decode, PIECEWISE):  24%|██▁       | 16/67 [00:01<00:04, 10.60it/s]
Capturing CUDA graphs (mixed prefill-decode, PIECEWISE):  27%|██▋       | 18/67 [00:01<00:04, 10.92it/s]
Capturing CUDA graphs (mixed prefill-decode, PIECEWISE):  30%|██▉       | 20/67 [00:01<00:04, 11.09it/s]
Capturing CUDA graphs (mixed prefill-decode, PIECEWISE):  33%|███▎      | 22/67 [00:02<00:04, 11.24it/s]
Capturing CUDA graphs (mixed prefill-decode, PIECEWISE):  36%|███▌      | 24/67 [00:02<00:03, 11.42it/s]
Capturing CUDA graphs (mixed prefill-decode, PIECEWISE):  39%|███▉      | 26/67 [00:02<00:03, 11.54it/s]
Capturing CUDA graphs (mixed prefill-decode, PIECEWISE):  42%|████▁     | 28/67 [00:02<00:03, 11.58it/s]
Capturing CUDA graphs (mixed prefill-decode, PIECEWISE):  45%|████▁     | 30/67 [00:02<00:03, 11.63it/s]
Capturing CUDA graphs (mixed prefill-decode, PIECEWISE):  48%|████▊     | 32/67 [00:02<00:03, 11.57it/s]
Capturing CUDA graphs (mixed prefill-decode, PIECEWISE):  51%|█████     | 34/67 [00:03<00:02, 11.87it/s]
Capturing CUDA graphs (mixed prefill-decode, PIECEWISE):  54%|█████▎    | 36/67 [00:03<00:02, 12.24it/s]
Capturing CUDA graphs (mixed prefill-decode, PIECEWISE):  57%|█████▋    | 38/67 [00:03<00:02, 12.52it/s]
Capturing CUDA graphs (mixed prefill-decode, PIECEWISE):  60%|█████▉    | 40/67 [00:03<00:02, 12.59it/s]
Capturing CUDA graphs (mixed prefill-decode, PIECEWISE):  63%|██████▎   | 42/67 [00:03<00:01, 12.82it/s]
Capturing CUDA graphs (mixed prefill-decode, PIECEWISE):  66%|██████▌   | 44/67 [00:03<00:01, 12.85it/s]
Capturing CUDA graphs (mixed prefill-decode, PIECEWISE):  69%|██████▊   | 46/67 [00:03<00:01, 13.14it/s]
Capturing CUDA graphs (mixed prefill-decode, PIECEWISE):  72%|███████▁  | 48/67 [00:04<00:01, 13.18it/s]
Capturing CUDA graphs (mixed prefill-decode, PIECEWISE):  75%|███████▁  | 50/67 [00:04<00:01, 13.70it/s]
Capturing CUDA graphs (mixed prefill-decode, PIECEWISE):  78%|███████▊  | 52/67 [00:04<00:01, 14.09it/s]
Capturing CUDA graphs (mixed prefill-decode, PIECEWISE):  81%|████████  | 54/67 [00:04<00:00, 14.38it/s]
Capturing CUDA graphs (mixed prefill-decode, PIECEWISE):  84%|████████▎ | 56/67 [00:04<00:00, 14.68it/s]
Capturing CUDA graphs (mixed prefill-decode, PIECEWISE):  87%|████████▋ | 58/67 [00:04<00:00, 14.92it/s]
Capturing CUDA graphs (mixed prefill-decode, PIECEWISE):  90%|████████▉ | 60/67 [00:04<00:00, 15.09it/s]
Capturing CUDA graphs (mixed prefill-decode, PIECEWISE):  93%|█████████▎| 62/67 [00:05<00:00, 15.25it/s]
Capturing CUDA graphs (mixed prefill-decode, PIECEWISE):  96%|█████████▌| 64/67 [00:05<00:00, 15.42it/s]
Capturing CUDA graphs (mixed prefill-decode, PIECEWISE):  99%|█████████▊| 66/67 [00:05<00:00, 15.48it/s]
Capturing CUDA graphs (mixed prefill-decode, PIECEWISE): 100%|██████████| 67/67 [00:05<00:00, 12.48it/s]
2025-10-29 20:07:22,686 - __main__ - WARNING - Attempt 71: Please wait for vllm server to become ready...
2025-10-29 20:07:23,733 - __main__ - WARNING - Attempt 72: Please wait for vllm server to become ready...
2025-10-29 20:07:24,301 - vllm - INFO - [1;36m(EngineCore_DP0 pid=51641)[0;0m 
Capturing CUDA graphs (decode, FULL):   0%|          | 0/35 [00:00<?, ?it/s]
Capturing CUDA graphs (decode, FULL):   3%|▎         | 1/35 [00:00<00:04,  6.97it/s]
Capturing CUDA graphs (decode, FULL):   9%|▊         | 3/35 [00:00<00:03, 10.56it/s]
Capturing CUDA graphs (decode, FULL):  14%|█▁        | 5/35 [00:00<00:02, 11.52it/s]
Capturing CUDA graphs (decode, FULL):  20%|██        | 7/35 [00:00<00:02, 12.13it/s]
Capturing CUDA graphs (decode, FULL):  26%|██▌       | 9/35 [00:00<00:02, 12.57it/s]
Capturing CUDA graphs (decode, FULL):  31%|███▁      | 11/35 [00:00<00:01, 12.30it/s]
Capturing CUDA graphs (decode, FULL):  37%|███▋      | 13/35 [00:01<00:01, 12.76it/s]
Capturing CUDA graphs (decode, FULL):  43%|████▎     | 15/35 [00:01<00:01, 13.11it/s]
Capturing CUDA graphs (decode, FULL):  49%|████▊     | 17/35 [00:01<00:01, 13.63it/s]
Capturing CUDA graphs (decode, FULL):  54%|█████▁    | 19/35 [00:01<00:01, 13.94it/s]
Capturing CUDA graphs (decode, FULL):  60%|██████    | 21/35 [00:01<00:00, 14.43it/s]
Capturing CUDA graphs (decode, FULL):  66%|██████▌   | 23/35 [00:01<00:00, 14.95it/s]
Capturing CUDA graphs (decode, FULL):  71%|███████▁  | 25/35 [00:01<00:00, 15.16it/s]
Capturing CUDA graphs (decode, FULL):  77%|███████▋  | 27/35 [00:01<00:00, 15.62it/s]
Capturing CUDA graphs (decode, FULL):  83%|████████▎ | 29/35 [00:02<00:00, 15.82it/s]
Capturing CUDA graphs (decode, FULL):  89%|████████▊ | 31/35 [00:02<00:00, 16.17it/s]
Capturing CUDA graphs (decode, FULL):  94%|█████████▁| 33/35 [00:02<00:00, 16.51it/s]
Capturing CUDA graphs (decode, FULL): 100%|██████████| 35/35 [00:02<00:00, 16.86it/s]
Capturing CUDA graphs (decode, FULL): 100%|██████████| 35/35 [00:02<00:00, 14.26it/s]
2025-10-29 20:07:24,678 - vllm - INFO - [1;36m(EngineCore_DP0 pid=51641)[0;0m INFO 10-29 20:07:24 [gpu_model_runner.py:3480] Graph capturing finished in 9 secs, took 2.75 GiB
2025-10-29 20:07:24,726 - vllm - INFO - [1;36m(EngineCore_DP0 pid=51641)[0;0m INFO 10-29 20:07:24 [core.py:210] init engine (profile, create kv cache, warmup model) took 38.92 seconds
2025-10-29 20:07:24,773 - __main__ - WARNING - Attempt 73: Please wait for vllm server to become ready...
2025-10-29 20:07:25,709 - vllm - INFO - [1;36m(APIServer pid=51622)[0;0m INFO 10-29 20:07:25 [loggers.py:147] Engine 000: vllm cache_config_info with initialization after num_gpu_blocks is: 5380
2025-10-29 20:07:25,812 - __main__ - WARNING - Attempt 74: Please wait for vllm server to become ready...
2025-10-29 20:07:25,939 - vllm - INFO - [1;36m(APIServer pid=51622)[0;0m INFO 10-29 20:07:25 [api_server.py:1634] Supported_tasks: ['generate']
2025-10-29 20:07:26,015 - vllm - INFO - [1;36m(APIServer pid=51622)[0;0m WARNING 10-29 20:07:26 [model.py:1389] Default sampling parameters have been overridden by the model's Hugging Face generation config recommended from the model creator. If this is not intended, please relaunch vLLM instance with `--generation-config vllm`.
2025-10-29 20:07:26,015 - vllm - INFO - [1;36m(APIServer pid=51622)[0;0m INFO 10-29 20:07:26 [serving_responses.py:137] Using default chat sampling params from model: {'repetition_penalty': 1.05, 'temperature': 1e-06}
2025-10-29 20:07:26,078 - vllm - INFO - [1;36m(APIServer pid=51622)[0;0m INFO 10-29 20:07:26 [serving_chat.py:139] Using default chat sampling params from model: {'repetition_penalty': 1.05, 'temperature': 1e-06}
2025-10-29 20:07:26,142 - vllm - INFO - [1;36m(APIServer pid=51622)[0;0m INFO 10-29 20:07:26 [serving_completion.py:76] Using default completion sampling params from model: {'repetition_penalty': 1.05, 'temperature': 1e-06}
2025-10-29 20:07:26,142 - vllm - INFO - [1;36m(APIServer pid=51622)[0;0m INFO 10-29 20:07:26 [api_server.py:1912] Starting vLLM API server 0 on http://0.0.0.0:30024
2025-10-29 20:07:26,142 - vllm - INFO - [1;36m(APIServer pid=51622)[0;0m INFO 10-29 20:07:26 [launcher.py:34] Available routes are:
2025-10-29 20:07:26,142 - vllm - INFO - [1;36m(APIServer pid=51622)[0;0m INFO 10-29 20:07:26 [launcher.py:42] Route: /openapi.json, Methods: GET, HEAD
2025-10-29 20:07:26,142 - vllm - INFO - [1;36m(APIServer pid=51622)[0;0m INFO 10-29 20:07:26 [launcher.py:42] Route: /docs, Methods: GET, HEAD
2025-10-29 20:07:26,142 - vllm - INFO - [1;36m(APIServer pid=51622)[0;0m INFO 10-29 20:07:26 [launcher.py:42] Route: /docs/oauth2-redirect, Methods: GET, HEAD
2025-10-29 20:07:26,143 - vllm - INFO - [1;36m(APIServer pid=51622)[0;0m INFO 10-29 20:07:26 [launcher.py:42] Route: /redoc, Methods: GET, HEAD
2025-10-29 20:07:26,143 - vllm - INFO - [1;36m(APIServer pid=51622)[0;0m INFO 10-29 20:07:26 [launcher.py:42] Route: /health, Methods: GET
2025-10-29 20:07:26,143 - vllm - INFO - [1;36m(APIServer pid=51622)[0;0m INFO 10-29 20:07:26 [launcher.py:42] Route: /load, Methods: GET
2025-10-29 20:07:26,143 - vllm - INFO - [1;36m(APIServer pid=51622)[0;0m INFO 10-29 20:07:26 [launcher.py:42] Route: /ping, Methods: POST
2025-10-29 20:07:26,143 - vllm - INFO - [1;36m(APIServer pid=51622)[0;0m INFO 10-29 20:07:26 [launcher.py:42] Route: /ping, Methods: GET
2025-10-29 20:07:26,143 - vllm - INFO - [1;36m(APIServer pid=51622)[0;0m INFO 10-29 20:07:26 [launcher.py:42] Route: /tokenize, Methods: POST
2025-10-29 20:07:26,143 - vllm - INFO - [1;36m(APIServer pid=51622)[0;0m INFO 10-29 20:07:26 [launcher.py:42] Route: /detokenize, Methods: POST
2025-10-29 20:07:26,143 - vllm - INFO - [1;36m(APIServer pid=51622)[0;0m INFO 10-29 20:07:26 [launcher.py:42] Route: /v1/models, Methods: GET
2025-10-29 20:07:26,143 - vllm - INFO - [1;36m(APIServer pid=51622)[0;0m INFO 10-29 20:07:26 [launcher.py:42] Route: /version, Methods: GET
2025-10-29 20:07:26,143 - vllm - INFO - [1;36m(APIServer pid=51622)[0;0m INFO 10-29 20:07:26 [launcher.py:42] Route: /v1/responses, Methods: POST
2025-10-29 20:07:26,143 - vllm - INFO - [1;36m(APIServer pid=51622)[0;0m INFO 10-29 20:07:26 [launcher.py:42] Route: /v1/responses/{response_id}, Methods: GET
2025-10-29 20:07:26,144 - vllm - INFO - [1;36m(APIServer pid=51622)[0;0m INFO 10-29 20:07:26 [launcher.py:42] Route: /v1/responses/{response_id}/cancel, Methods: POST
2025-10-29 20:07:26,144 - vllm - INFO - [1;36m(APIServer pid=51622)[0;0m INFO 10-29 20:07:26 [launcher.py:42] Route: /v1/chat/completions, Methods: POST
2025-10-29 20:07:26,144 - vllm - INFO - [1;36m(APIServer pid=51622)[0;0m INFO 10-29 20:07:26 [launcher.py:42] Route: /v1/completions, Methods: POST
2025-10-29 20:07:26,144 - vllm - INFO - [1;36m(APIServer pid=51622)[0;0m INFO 10-29 20:07:26 [launcher.py:42] Route: /v1/embeddings, Methods: POST
2025-10-29 20:07:26,144 - vllm - INFO - [1;36m(APIServer pid=51622)[0;0m INFO 10-29 20:07:26 [launcher.py:42] Route: /pooling, Methods: POST
2025-10-29 20:07:26,144 - vllm - INFO - [1;36m(APIServer pid=51622)[0;0m INFO 10-29 20:07:26 [launcher.py:42] Route: /classify, Methods: POST
2025-10-29 20:07:26,144 - vllm - INFO - [1;36m(APIServer pid=51622)[0;0m INFO 10-29 20:07:26 [launcher.py:42] Route: /score, Methods: POST
2025-10-29 20:07:26,144 - vllm - INFO - [1;36m(APIServer pid=51622)[0;0m INFO 10-29 20:07:26 [launcher.py:42] Route: /v1/score, Methods: POST
2025-10-29 20:07:26,144 - vllm - INFO - [1;36m(APIServer pid=51622)[0;0m INFO 10-29 20:07:26 [launcher.py:42] Route: /v1/audio/transcriptions, Methods: POST
2025-10-29 20:07:26,144 - vllm - INFO - [1;36m(APIServer pid=51622)[0;0m INFO 10-29 20:07:26 [launcher.py:42] Route: /v1/audio/translations, Methods: POST
2025-10-29 20:07:26,144 - vllm - INFO - [1;36m(APIServer pid=51622)[0;0m INFO 10-29 20:07:26 [launcher.py:42] Route: /rerank, Methods: POST
2025-10-29 20:07:26,144 - vllm - INFO - [1;36m(APIServer pid=51622)[0;0m INFO 10-29 20:07:26 [launcher.py:42] Route: /v1/rerank, Methods: POST
2025-10-29 20:07:26,144 - vllm - INFO - [1;36m(APIServer pid=51622)[0;0m INFO 10-29 20:07:26 [launcher.py:42] Route: /v2/rerank, Methods: POST
2025-10-29 20:07:26,144 - vllm - INFO - [1;36m(APIServer pid=51622)[0;0m INFO 10-29 20:07:26 [launcher.py:42] Route: /scale_elastic_ep, Methods: POST
2025-10-29 20:07:26,144 - vllm - INFO - [1;36m(APIServer pid=51622)[0;0m INFO 10-29 20:07:26 [launcher.py:42] Route: /is_scaling_elastic_ep, Methods: POST
2025-10-29 20:07:26,144 - vllm - INFO - [1;36m(APIServer pid=51622)[0;0m INFO 10-29 20:07:26 [launcher.py:42] Route: /invocations, Methods: POST
2025-10-29 20:07:26,144 - vllm - INFO - [1;36m(APIServer pid=51622)[0;0m INFO 10-29 20:07:26 [launcher.py:42] Route: /metrics, Methods: GET
INFO:httpx:HTTP Request: GET http://localhost:30024/v1/models "HTTP/1.1 200 OK"
2025-10-29 20:07:26,853 - __main__ - INFO - vllm server is ready.
2025-10-29 20:07:26,853 - __main__ - INFO - Queue remaining: 1
2025-10-29 20:07:26,853 - __main__ - INFO - 
Metric Name                        Lifetime (tokens/sec)     Recently (tokens/sec)
----------------------------------------------------------------------------------
2025-10-29 20:07:26,853 - __main__ - INFO - 
Worker ID
---------
2025-10-29 20:07:26,854 - __main__ - INFO - Worker 0 processing work item c0c43b4cea29f38834a866c1fc85eb530deb8b96
2025-10-29 20:07:26,854 - __main__ - INFO - Created all tasks for c0c43b4cea29f38834a866c1fc85eb530deb8b96
2025-10-29 20:07:27,420 - vllm - INFO - [1;36m(APIServer pid=51622)[0;0m The image processor of type `Qwen2VLImageProcessor` is now loaded as a fast processor by default, even if the model checkpoint was saved with a slow processor. This is a breaking change and may produce slightly different outputs. To continue using the slow processor, instantiate this class with `use_fast=False`. Note that this behavior will be extended to all models in a future release.
2025-10-29 20:07:28,337 - vllm - INFO - [1;36m(APIServer pid=51622)[0;0m You have video processor config saved in `preprocessor.json` file which is deprecated. Video processor configs should be saved in their own `video_preprocessor.json` file. You can rename the file or load and save the processor back which renames it automatically. Loading from `preprocessor.json` will be removed in v5.0.
2025-10-29 20:07:29,319 - vllm - INFO - [1;36m(APIServer pid=51622)[0;0m INFO 10-29 20:07:29 [chat_utils.py:560] Detected the chat template content format to be 'openai'. You can set `--chat-template-content-format` to override this.
2025-10-29 20:07:36,573 - vllm - INFO - [1;36m(APIServer pid=51622)[0;0m INFO 10-29 20:07:36 [loggers.py:127] Engine 000: Avg prompt throughput: 366.5 tokens/s, Avg generation throughput: 0.3 tokens/s, Running: 3 reqs, Waiting: 3 reqs, GPU KV cache usage: 4.7%, Prefix cache hit rate: 10.7%
2025-10-29 20:07:36,573 - __main__ - INFO - New peak running requests: 3
2025-10-29 20:07:36,573 - __main__ - INFO - vllm running req: 3 queue req: 3
2025-10-29 20:07:36,855 - __main__ - INFO - Queue remaining: 0
2025-10-29 20:07:36,855 - __main__ - INFO - 
Metric Name                        Lifetime (tokens/sec)     Recently (tokens/sec)
----------------------------------------------------------------------------------
2025-10-29 20:07:36,855 - __main__ - INFO - 
Worker ID | started
----------+--------
0         | 28     
2025-10-29 20:07:46,574 - vllm - INFO - [1;36m(APIServer pid=51622)[0;0m INFO 10-29 20:07:46 [loggers.py:127] Engine 000: Avg prompt throughput: 2787.0 tokens/s, Avg generation throughput: 11.6 tokens/s, Running: 17 reqs, Waiting: 11 reqs, GPU KV cache usage: 33.4%, Prefix cache hit rate: 15.1%
2025-10-29 20:07:46,574 - __main__ - INFO - New peak running requests: 17
2025-10-29 20:07:46,574 - __main__ - INFO - vllm running req: 17 queue req: 11
2025-10-29 20:07:46,856 - __main__ - INFO - Queue remaining: 0
2025-10-29 20:07:46,856 - __main__ - INFO - 
Metric Name                        Lifetime (tokens/sec)     Recently (tokens/sec)
----------------------------------------------------------------------------------
2025-10-29 20:07:46,856 - __main__ - INFO - 
Worker ID | started
----------+--------
0         | 28     
2025-10-29 20:07:56,575 - vllm - INFO - [1;36m(APIServer pid=51622)[0;0m INFO 10-29 20:07:56 [loggers.py:127] Engine 000: Avg prompt throughput: 2389.0 tokens/s, Avg generation throughput: 160.2 tokens/s, Running: 28 reqs, Waiting: 0 reqs, GPU KV cache usage: 56.9%, Prefix cache hit rate: 15.5%
2025-10-29 20:07:56,575 - __main__ - INFO - New peak running requests: 28
2025-10-29 20:07:56,575 - __main__ - INFO - vllm running req: 28 queue req: 0
2025-10-29 20:07:56,857 - __main__ - INFO - Queue remaining: 0
2025-10-29 20:07:56,858 - __main__ - INFO - 
Metric Name                        Lifetime (tokens/sec)     Recently (tokens/sec)
----------------------------------------------------------------------------------
2025-10-29 20:07:56,858 - __main__ - INFO - 
Worker ID | started
----------+--------
0         | 28     
2025-10-29 20:08:06,576 - vllm - INFO - [1;36m(APIServer pid=51622)[0;0m INFO 10-29 20:08:06 [loggers.py:127] Engine 000: Avg prompt throughput: 0.0 tokens/s, Avg generation throughput: 500.2 tokens/s, Running: 21 reqs, Waiting: 0 reqs, GPU KV cache usage: 47.7%, Prefix cache hit rate: 15.5%
2025-10-29 20:08:06,576 - __main__ - INFO - Running requests decreased: 28 -> 21
2025-10-29 20:08:06,576 - __main__ - INFO - vllm running req: 21 queue req: 0
2025-10-29 20:08:06,859 - __main__ - INFO - Queue remaining: 0
2025-10-29 20:08:06,859 - __main__ - INFO - 
Metric Name                        Lifetime (tokens/sec)     Recently (tokens/sec)
----------------------------------------------------------------------------------
completed_pages                           0.06                      0.06
finished_on_attempt_0                      0.06                      0.06
server_input_tokens                     118.62                    118.62
server_output_tokens                     10.24                     10.24
2025-10-29 20:08:06,859 - __main__ - INFO - 
Worker ID | finished | started
----------+----------+--------
0         | 7        | 28     
2025-10-29 20:08:06,999 - __main__ - INFO - Semaphore released at 21 running 0 queued, peak: 28)
2025-10-29 20:08:06,999 - __main__ - INFO - Worker 1 exiting due to empty queue
2025-10-29 20:08:06,999 - __main__ - INFO - Worker 2 exiting due to empty queue
2025-10-29 20:08:06,999 - __main__ - INFO - Worker 3 exiting due to empty queue
2025-10-29 20:08:06,999 - __main__ - INFO - Worker 4 exiting due to empty queue
2025-10-29 20:08:06,999 - __main__ - INFO - Worker 5 exiting due to empty queue
2025-10-29 20:08:16,577 - vllm - INFO - [1;36m(APIServer pid=51622)[0;0m INFO 10-29 20:08:16 [loggers.py:127] Engine 000: Avg prompt throughput: 0.0 tokens/s, Avg generation throughput: 412.9 tokens/s, Running: 18 reqs, Waiting: 0 reqs, GPU KV cache usage: 45.4%, Prefix cache hit rate: 15.5%
2025-10-29 20:08:16,577 - __main__ - INFO - Running requests decreased: 21 -> 18
2025-10-29 20:08:16,577 - __main__ - INFO - vllm running req: 18 queue req: 0
2025-10-29 20:08:16,860 - __main__ - INFO - Queue remaining: 0
2025-10-29 20:08:16,861 - __main__ - INFO - 
Metric Name                        Lifetime (tokens/sec)     Recently (tokens/sec)
----------------------------------------------------------------------------------
completed_pages                           0.08                      0.08
finished_on_attempt_0                      0.08                      0.08
server_input_tokens                     156.16                    156.16
server_output_tokens                     18.28                     18.28
2025-10-29 20:08:16,861 - __main__ - INFO - 
Worker ID | finished | started
----------+----------+--------
0         | 10       | 28     
2025-10-29 20:08:26,576 - vllm - INFO - [1;36m(APIServer pid=51622)[0;0m INFO 10-29 20:08:26 [loggers.py:127] Engine 000: Avg prompt throughput: 0.0 tokens/s, Avg generation throughput: 316.8 tokens/s, Running: 10 reqs, Waiting: 0 reqs, GPU KV cache usage: 28.0%, Prefix cache hit rate: 15.5%
2025-10-29 20:08:26,576 - __main__ - INFO - vllm running req: 10 queue req: 0
2025-10-29 20:08:26,863 - __main__ - INFO - Queue remaining: 0
2025-10-29 20:08:26,863 - __main__ - INFO - 
Metric Name                        Lifetime (tokens/sec)     Recently (tokens/sec)
----------------------------------------------------------------------------------
completed_pages                           0.14                      0.14
finished_on_attempt_0                      0.14                      0.14
server_input_tokens                     275.13                    275.13
server_output_tokens                     56.10                     56.10
2025-10-29 20:08:26,863 - __main__ - INFO - 
Worker ID | finished | started
----------+----------+--------
0         | 19       | 28     
2025-10-29 20:08:36,534 - __main__ - INFO - Finished TaskGroup for worker on c0c43b4cea29f38834a866c1fc85eb530deb8b96
2025-10-29 20:08:36,534 - __main__ - INFO - Got 1 docs for c0c43b4cea29f38834a866c1fc85eb530deb8b96
2025-10-29 20:08:36,536 - __main__ - INFO - Writing 1 markdown files for c0c43b4cea29f38834a866c1fc85eb530deb8b96
2025-10-29 20:08:36,537 - __main__ - INFO - Worker 0 exiting due to empty queue
2025-10-29 20:08:36,537 - __main__ - INFO - Got cancellation request for VLLM server
2025-10-29 20:08:36,545 - vllm - INFO - [1;36m(APIServer pid=51622)[0;0m INFO 10-29 20:08:36 [launcher.py:99] Shutting down FastAPI HTTP server.
2025-10-29 20:08:36,630 - vllm - INFO - [rank0]:[W1029 20:08:36.915124650 ProcessGroupNCCL.cpp:1538] Warning: WARNING: destroy_process_group() was not called before program exit, which can leak resources. For more info, please see https://pytorch.org/docs/stable/distributed.html#shutdown (function operator())
2025-10-29 20:08:39,029 - vllm - INFO - [1;36m(APIServer pid=51622)[0;0m INFO 10-29 20:08:39 [loggers.py:127] Engine 000: Avg prompt throughput: 0.0 tokens/s, Avg generation throughput: 89.3 tokens/s, Running: 0 reqs, Waiting: 0 reqs, GPU KV cache usage: 0.0%, Prefix cache hit rate: 15.5%
2025-10-29 20:08:39,029 - __main__ - INFO - vllm running req: 0 queue req: 0
2025-10-29 20:08:39,545 - __main__ - INFO - ================================================================================
2025-10-29 20:08:39,545 - __main__ - INFO - FINAL METRICS SUMMARY
2025-10-29 20:08:39,546 - __main__ - INFO - ================================================================================
2025-10-29 20:08:39,546 - __main__ - INFO - Total elapsed time: 150.18 seconds
2025-10-29 20:08:39,546 - __main__ - INFO - Total Server Input tokens: 55,748
2025-10-29 20:08:39,546 - __main__ - INFO - Total Server Output tokens: 15,133
2025-10-29 20:08:39,546 - __main__ - INFO - Finished input tokens: 55,748
2025-10-29 20:08:39,546 - __main__ - INFO - Finished output tokens: 15,133
2025-10-29 20:08:39,546 - __main__ - INFO - Completed pages: 28
2025-10-29 20:08:39,546 - __main__ - INFO - Failed pages: 0
2025-10-29 20:08:39,546 - __main__ - INFO - Page Failure rate: 0.00%
2025-10-29 20:08:39,546 - __main__ - INFO - 
2025-10-29 20:08:39,546 - __main__ - INFO - Pages finished by attempt number:
2025-10-29 20:08:39,547 - __main__ - INFO -   Attempt 0: 28 pages (100.0%) - Cumulative: 28 (100.0%)
2025-10-29 20:08:39,547 - __main__ - INFO - Server Input tokens/sec rate: 371.21
2025-10-29 20:08:39,547 - __main__ - INFO - Server Output tokens/sec rate: 100.77
2025-10-29 20:08:39,547 - __main__ - INFO - Finished Input tokens/sec rate: 371.21
2025-10-29 20:08:39,547 - __main__ - INFO - Finished Output tokens/sec rate: 100.77
2025-10-29 20:08:39,547 - __main__ - INFO - ================================================================================
2025-10-29 20:08:39,547 - __main__ - INFO - Work done
2025-10-29 20:08:39,548 - __main__ - INFO - VLLM Process already terminated
